# ProductHunt-Statistic

Auto-updated catalog of **[Product Hunt launches producthunt.com]([https://www.producthunt.com/](https://www.producthunt.com/leaderboard/daily/2026/1/21?ref=header_nav))** with simple **daily stats**.

[![Follow me on Product Hunt](https://img.shields.io/badge/Follow%20me%20on%20Product%20Hunt-@nbox-orange?style=for-the-badge)](https://www.producthunt.com/@nbox)



This repository automatically:
- fetches launches for **today** (based on a configured timezone),
- creates/updates a daily Markdown report in `YYYY/MM/DD-MM-YYYY.md`,
- updates this `README.md` with:
  - a â€œTodayâ€ summary + full table,
  - an archive navigation (expandable by year and month).

## Archive

<!-- START:ARCHIVE -->
<details>
<summary>2026</summary>

  <details>
  <summary>02</summary>

  - [18-02-2026](2026/02/18-02-2026.md)
  - [17-02-2026](2026/02/17-02-2026.md)
  - [16-02-2026](2026/02/16-02-2026.md)
  - [15-02-2026](2026/02/15-02-2026.md)
  - [14-02-2026](2026/02/14-02-2026.md)
  - [13-02-2026](2026/02/13-02-2026.md)
  - [12-02-2026](2026/02/12-02-2026.md)
  - [11-02-2026](2026/02/11-02-2026.md)
  - [10-02-2026](2026/02/10-02-2026.md)
  - [09-02-2026](2026/02/09-02-2026.md)
  - [08-02-2026](2026/02/08-02-2026.md)
  - [07-02-2026](2026/02/07-02-2026.md)
  - [06-02-2026](2026/02/06-02-2026.md)
  - [05-02-2026](2026/02/05-02-2026.md)
  - [04-02-2026](2026/02/04-02-2026.md)
  - [03-02-2026](2026/02/03-02-2026.md)
  - [02-02-2026](2026/02/02-02-2026.md)
  - [01-02-2026](2026/02/01-02-2026.md)

  </details>

  <details>
  <summary>01</summary>

  - [31-01-2026](2026/01/31-01-2026.md)
  - [30-01-2026](2026/01/30-01-2026.md)
  - [29-01-2026](2026/01/29-01-2026.md)
  - [28-01-2026](2026/01/28-01-2026.md)
  - [27-01-2026](2026/01/27-01-2026.md)
  - [26-01-2026](2026/01/26-01-2026.md)
  - [25-01-2026](2026/01/25-01-2026.md)
  - [24-01-2026](2026/01/24-01-2026.md)
  - [23-01-2026](2026/01/23-01-2026.md)
  - [22-01-2026](2026/01/22-01-2026.md)
  - [21-01-2026](2026/01/21-01-2026.md)
  - [20-01-2026](2026/01/20-01-2026.md)
  - [19-01-2026](2026/01/19-01-2026.md)

  </details>

</details>

<!-- END:ARCHIVE -->

## Today

<!-- START:PH_TODAY -->
### 18-02-2026 (America/Los_Angeles)

- Launches: **582**
- Total votes: **4315**
- Avg / Median votes: **7.41 / 2.00**
- Total comments: **786**
- Avg / Median comments: **1.35 / 1.00**
- Full report: [18-02-2026](<2026/02/18-02-2026.md>)

| # | App | Description | Votes | Comments | Website |
|---:|---|---|---:|---:|---|
| 1 | [Sonnet 4.6](<https://www.producthunt.com/products/claude?utm_campaign=producthunt-api&utm_medium=api-v2&utm_source=Application%3A+StatisticAPI+%28ID%3A+263803%29>) | The most capable Sonnet model yet<br><details><summary><strong>Full description</strong></summary><br>Claude Sonnet 4.6 is a full upgrade across coding, computer use, long-context reasoning, agent planning, knowledge work, and design. It also features a 1M token context window in beta. Sonnet 4.6 has improved on benchmarks across the board. It approaches Opus-level intelligence at a price point that makes it practical for far more tasks. It also shows a major improvement in computer use skills.<br></details> | 418 | 11 | [ğŸ”—](<https://www.producthunt.com/r/XRJAQEGV3YYNPN?utm_campaign=producthunt-api&utm_medium=api-v2&utm_source=Application%3A+StatisticAPI+%28ID%3A+263803%29>) |
| 2 | [Moda](<https://www.producthunt.com/products/moda-2?utm_campaign=producthunt-api&utm_medium=api-v2&utm_source=Application%3A+StatisticAPI+%28ID%3A+263803%29>) | Finally, AI designs you can edit<br><details><summary><strong>Full description</strong></summary><br>Moda helps you design beautiful, brand-aligned content - slides, posters, ads, and more - with an AI trained in graphic design. Unlike other AI tools, everything is fully editable on a powerful layered canvas.<br></details> | 358 | 56 | [ğŸ”—](<https://www.producthunt.com/r/CXN2YMANFHJXCU?utm_campaign=producthunt-api&utm_medium=api-v2&utm_source=Application%3A+StatisticAPI+%28ID%3A+263803%29>) |
| 3 | [Omnia](<https://www.producthunt.com/products/omnia-2?utm_campaign=producthunt-api&utm_medium=api-v2&utm_source=Application%3A+StatisticAPI+%28ID%3A+263803%29>) | Become the brand AI recommends<br><details><summary><strong>Full description</strong></summary><br>Omnia is an AI visibility tool that shows how AI sees your brand and helps you take action. Discover real AI prompts, monitor brand presence, benchmark competitors, and create content that boosts visibility and citations in AI search.<br></details> | 226 | 35 | [ğŸ”—](<https://www.producthunt.com/r/P2QNFKXIJOJQ5N?utm_campaign=producthunt-api&utm_medium=api-v2&utm_source=Application%3A+StatisticAPI+%28ID%3A+263803%29>) |
| 4 | [Flixier Generate AI Video in Timeline](<https://www.producthunt.com/products/flixier?utm_campaign=producthunt-api&utm_medium=api-v2&utm_source=Application%3A+StatisticAPI+%28ID%3A+263803%29>) | Extend shots, connect clips, generate from any frame<br><details><summary><strong>Full description</strong></summary><br>Most AI video tools stop at generation. Flixier brings AI into the editing timeline, so you can generate, extend, and connect clips, trim, polish and finish videos in one place, without exporting or rebuilding elsewhere.<br></details> | 158 | 21 | [ğŸ”—](<https://www.producthunt.com/r/2J7TBBVCY7KL7J?utm_campaign=producthunt-api&utm_medium=api-v2&utm_source=Application%3A+StatisticAPI+%28ID%3A+263803%29>) |
| 5 | [ClawMetry for OpenClaw](<https://www.producthunt.com/products/clawmetry?utm_campaign=producthunt-api&utm_medium=api-v2&utm_source=Application%3A+StatisticAPI+%28ID%3A+263803%29>) | Real-time observability dashboard for OpenClaw AI agents<br><details><summary><strong>Full description</strong></summary><br>ClawMetry is a free, open-source observability dashboard for OpenClaw AI agents. Think Grafana, but purpose-built for AI. One command install (pip install clawmetry), zero config. Monitor token costs, sub-agent activity, cron jobs, memory changes, and session history. All in real-time with a beautiful live flow visualization. Works on macOS, Linux, Windows, even Raspberry Pi<br></details> | 125 | 5 | [ğŸ”—](<https://www.producthunt.com/r/JKIL5I3A43NUWI?utm_campaign=producthunt-api&utm_medium=api-v2&utm_source=Application%3A+StatisticAPI+%28ID%3A+263803%29>) |
| 6 | [Travel Animator](<https://www.producthunt.com/products/travel-animator?utm_campaign=producthunt-api&utm_medium=api-v2&utm_source=Application%3A+StatisticAPI+%28ID%3A+263803%29>) | Name every stop your way with Place Labels<br><details><summary><strong>Full description</strong></summary><br>Place Labels are here âœ¨ Now you can highlight the places youâ€™ve visited right on your animated map, helping every route feel clearer, more personal, and easier to follow. With the new Place Label Customiser, you can choose from 6 thoughtfully designed styles, explore 7 colors to match your mood, and decide how labels appear with Current, Visited, or Always-on modes. Edit or remove them anytime. Tell your journey your way ğŸš€<br></details> | 123 | 7 | [ğŸ”—](<https://www.producthunt.com/r/VOTWBNKKAFFXMB?utm_campaign=producthunt-api&utm_medium=api-v2&utm_source=Application%3A+StatisticAPI+%28ID%3A+263803%29>) |
| 7 | [Design Rails](<https://www.producthunt.com/products/design-rails-ai-native-brand-in-mins?utm_campaign=producthunt-api&utm_medium=api-v2&utm_source=Application%3A+StatisticAPI+%28ID%3A+263803%29>) | Get an agent-ready brand in minutes<br><details><summary><strong>Full description</strong></summary><br>Chat with an AI creative director. Get a complete brand identity in minutesâ€”logo, colors, typography, voice &amp; tone, UI stylesâ€”all packaged as agent-ready files. No more generic UI. Drop the files into your project, and tools like Claude and Lovable generate on-brand UI from day one.<br></details> | 112 | 12 | [ğŸ”—](<https://www.producthunt.com/r/OB4CXSZGF6WGRV?utm_campaign=producthunt-api&utm_medium=api-v2&utm_source=Application%3A+StatisticAPI+%28ID%3A+263803%29>) |
| 8 | [Your AI Clone](<https://www.producthunt.com/products/your-ai-clone?utm_campaign=producthunt-api&utm_medium=api-v2&utm_source=Application%3A+StatisticAPI+%28ID%3A+263803%29>) | Your clone remembers people you&#x27;ve never met<br><details><summary><strong>Full description</strong></summary><br>Build an AI clone trained on your real content, voice, and personality. It gets its own page, talks to your audience 24/7, and remembers every person it speaks to across sessions. Monetize it or keep it free.<br></details> | 99 | 3 | [ğŸ”—](<https://www.producthunt.com/r/RMUPNE7DZIF2BR?utm_campaign=producthunt-api&utm_medium=api-v2&utm_source=Application%3A+StatisticAPI+%28ID%3A+263803%29>) |
| 9 | [Empirical Health for web](<https://www.producthunt.com/products/empirical-health?utm_campaign=producthunt-api&utm_medium=api-v2&utm_source=Application%3A+StatisticAPI+%28ID%3A+263803%29>) | Comprehensive preventive heart health solution scaled w/ AI<br><details><summary><strong>Full description</strong></summary><br>When Empirical Health first launched, it was centered around iOS and Android apps to help you optimize your heart health in your daily life. But sometimes you need a larger screen, especially when viewing blood test reports (there are 100+ biomarkers per test). Now, you can view all of your blood test results, check heart attack risk scores, message your doctor, and schedule lab reviews from your desktop or phone without downloading an app.<br></details> | 99 | 7 | [ğŸ”—](<https://www.producthunt.com/r/YDLCIZK56UJV22?utm_campaign=producthunt-api&utm_medium=api-v2&utm_source=Application%3A+StatisticAPI+%28ID%3A+263803%29>) |
| 10 | [SPECTRE](<https://www.producthunt.com/products/spectre-2?utm_campaign=producthunt-api&utm_medium=api-v2&utm_source=Application%3A+StatisticAPI+%28ID%3A+263803%29>) | An agentic coding workflow for product builders<br><details><summary><strong>Full description</strong></summary><br>SPECTRE is an agentic Coding Workflow - /Scope, /Plan, /Execute, /Clean, /Test, /Rebase, /Evaluate - that uses simply step by step product development workflow to generate high quality results from your AI Coding Agents. - Codename-Inc/spectre<br></details> | 99 | 11 | [ğŸ”—](<https://www.producthunt.com/r/CZQAMGV6OW6DHH?utm_campaign=producthunt-api&utm_medium=api-v2&utm_source=Application%3A+StatisticAPI+%28ID%3A+263803%29>) |
| 11 | [Reflex Rooster](<https://www.producthunt.com/products/reflex-rooster?utm_campaign=producthunt-api&utm_medium=api-v2&utm_source=Application%3A+StatisticAPI+%28ID%3A+263803%29>) | Can You React in Under 300ms!?<br><details><summary><strong>Full description</strong></summary><br>Test your reaction speed in Reflex Rooster â€“ the ultimate chicken scream reaction game. Compete in solo mode, endless streak mode, or multiplayer race. Track XP, ranks, badges, and beat your fastest reaction time.<br></details> | 93 | 8 | [ğŸ”—](<https://www.producthunt.com/r/KKNQM7UWPTNGKR?utm_campaign=producthunt-api&utm_medium=api-v2&utm_source=Application%3A+StatisticAPI+%28ID%3A+263803%29>) |
| 12 | [Calendarly](<https://www.producthunt.com/products/calendarly-calendar-on-lock-screen?utm_campaign=producthunt-api&utm_medium=api-v2&utm_source=Application%3A+StatisticAPI+%28ID%3A+263803%29>) | Turn your calendar into a live Lock Screen wallpaper<br><details><summary><strong>Full description</strong></summary><br>Calendarly turns your calendar into a live Lock Screen wallpaper that updates automatically throughout the day. See your schedule the moment you pick up your phone - no widgets to configure, no apps to open, no distractions pulling you away. Choose from beautifully designed templates and fully customize them to match your style, layout, and priorities. Fully private. Everything runs on-device.<br></details> | 93 | 5 | [ğŸ”—](<https://www.producthunt.com/r/VXIJIWRE4LHY6B?utm_campaign=producthunt-api&utm_medium=api-v2&utm_source=Application%3A+StatisticAPI+%28ID%3A+263803%29>) |
| 13 | [Baseline Core](<https://www.producthunt.com/products/baseline-core?utm_campaign=producthunt-api&utm_medium=api-v2&utm_source=Application%3A+StatisticAPI+%28ID%3A+263803%29>) | Open-source skills system that wires your business into AI<br><details><summary><strong>Full description</strong></summary><br>Baseline Core is an open-source skills system for AI agents. Run one command and your AI tools can research markets, write PRDs, plan sprints, and design user flows -- all grounded in your business context. 12 skills, 14 frameworks, 34 reference files. Works with Claude Code, Cursor, Codex, ChatGPT, Gemini, Windsurf, and GitHub Copilot. Free forever.<br></details> | 93 | 5 | [ğŸ”—](<https://www.producthunt.com/r/3RXUCRCNMRQAQX?utm_campaign=producthunt-api&utm_medium=api-v2&utm_source=Application%3A+StatisticAPI+%28ID%3A+263803%29>) |
| 14 | [OpenFlowKit](<https://www.producthunt.com/products/openflowkit?utm_campaign=producthunt-api&utm_medium=api-v2&utm_source=Application%3A+StatisticAPI+%28ID%3A+263803%29>) | 100% Free and Open Source Diagram Creator with Total Control<br><details><summary><strong>Full description</strong></summary><br>OpenFlowKit is a 100% free, open-source diagram engine for engineers, architects, and product teams who care about craft.<br></details> | 90 | 4 | [ğŸ”—](<https://www.producthunt.com/r/BBNGGMCDUL27C3?utm_campaign=producthunt-api&utm_medium=api-v2&utm_source=Application%3A+StatisticAPI+%28ID%3A+263803%29>) |
| 15 | [Open blivz](<https://www.producthunt.com/products/blivz?utm_campaign=producthunt-api&utm_medium=api-v2&utm_source=Application%3A+StatisticAPI+%28ID%3A+263803%29>) | Customizable Open-source alternative to Clay<br><details><summary><strong>Full description</strong></summary><br>blivz is an open-source, customizable tool for data enrichment, lead generation, and GTM workflows. Designed for modern GTM engineers, RevOps teams, and builders already using AI tools like Claude Code for GTM. blivz enables you to Run it locally and use Claude Code to fully customize your stack and GTM motion.<br></details> | 85 | 3 | [ğŸ”—](<https://www.producthunt.com/r/WZZW5452LENDHB?utm_campaign=producthunt-api&utm_medium=api-v2&utm_source=Application%3A+StatisticAPI+%28ID%3A+263803%29>) |
| 16 | [STUD](<https://www.producthunt.com/products/stud?utm_campaign=producthunt-api&utm_medium=api-v2&utm_source=Application%3A+StatisticAPI+%28ID%3A+263803%29>) | Cursor for Roblox Studio<br><details><summary><strong>Full description</strong></summary><br>Open-source AI coding assistant with deep Roblox Studio integration. Edit Luau scripts, manipulate instances, query DataStores, and search the Toolbox.<br></details> | 80 | 2 | [ğŸ”—](<https://www.producthunt.com/r/5YG6ULPTJITOGG?utm_campaign=producthunt-api&utm_medium=api-v2&utm_source=Application%3A+StatisticAPI+%28ID%3A+263803%29>) |
| 17 | [yottoCode](<https://www.producthunt.com/products/yottocode?utm_campaign=producthunt-api&utm_medium=api-v2&utm_source=Application%3A+StatisticAPI+%28ID%3A+263803%29>) | Claude Code, meet Telegram.<br><details><summary><strong>Full description</strong></summary><br>A native macOS app that bridges Claude Code and Telegram â€” built on the official Anthropic Agent SDK. Full agent controls from Telegram. Voice in, voice out, permission keyboards, session resume â€” all built in.<br></details> | 78 | 8 | [ğŸ”—](<https://www.producthunt.com/r/AQUXZOTPJIENQN?utm_campaign=producthunt-api&utm_medium=api-v2&utm_source=Application%3A+StatisticAPI+%28ID%3A+263803%29>) |
| 18 | [Deckary](<https://www.producthunt.com/products/deckary?utm_campaign=producthunt-api&utm_medium=api-v2&utm_source=Application%3A+StatisticAPI+%28ID%3A+263803%29>) | The AI consulting toolkit for PowerPoint<br><details><summary><strong>Full description</strong></summary><br>Deckary is a PowerPoint add-in that gives you a complete consulting toolkit â€” right inside PowerPoint. Describe what you need, and the AI Slide Builder generates consulting-quality slides in seconds. Add Waterfall, Mekko, and Gantt charts linked to Excel. Drop in icons from a library of 2,000+. Speed up your workflow with keyboard shortcuts for alignment and formatting. Built by ex-MBB consultants. One-click install, Mac and Windows.<br></details> | 77 | 1 | [ğŸ”—](<https://www.producthunt.com/r/N43RQYAM6OURD3?utm_campaign=producthunt-api&utm_medium=api-v2&utm_source=Application%3A+StatisticAPI+%28ID%3A+263803%29>) |
| 19 | [Konta](<https://www.producthunt.com/products/konta?utm_campaign=producthunt-api&utm_medium=api-v2&utm_source=Application%3A+StatisticAPI+%28ID%3A+263803%29>) | GitOps for Docker Compose on lowâ€‘resource VPS<br><details><summary><strong>Full description</strong></summary><br>Store the state of your VPS containers in a repo. Konta helps you use Git as a single source of truth, automatically sync changes with server containers using docker-compose files â€” no cluster, no control plane. Simply push changes to Git, and your containers will be updated automatically.<br></details> | 75 | 3 | [ğŸ”—](<https://www.producthunt.com/r/F5EFEOV22JKCK5?utm_campaign=producthunt-api&utm_medium=api-v2&utm_source=Application%3A+StatisticAPI+%28ID%3A+263803%29>) |
| 20 | [Cencurity](<https://www.producthunt.com/products/cencurity?utm_campaign=producthunt-api&utm_medium=api-v2&utm_source=Application%3A+StatisticAPI+%28ID%3A+263803%29>) | Security gateway for LLM agents<br><details><summary><strong>Full description</strong></summary><br>Cencurity is a security gateway that proxies LLM/agent traffic and detects / masks / blocks sensitive data and risky code patterns in requests and responses, while recording everything as Audit Logs.<br></details> | 74 | 4 | [ğŸ”—](<https://www.producthunt.com/r/L4IEXFQN73RIK3?utm_campaign=producthunt-api&utm_medium=api-v2&utm_source=Application%3A+StatisticAPI+%28ID%3A+263803%29>) |
| 21 | [BotBot](<https://www.producthunt.com/products/botbot?utm_campaign=producthunt-api&utm_medium=api-v2&utm_source=Application%3A+StatisticAPI+%28ID%3A+263803%29>) | The open-source brain for any legged robot<br><details><summary><strong>Full description</strong></summary><br>BotBrain is a modular software and hardware platform that lets you control, map, and run autonomous missions on any legged or wheeled ROS2 robot. It combines a full ROS2 navigation stack, a web-based UI for control and fleet management, and 3D-printable hardware into a single, easy-to-deploy system. Built for developers, researchers, and operators who want to build on a solid foundation instead of starting from scratch.<br></details> | 73 | 1 | [ğŸ”—](<https://www.producthunt.com/r/HFNS7WS3T6MMTS?utm_campaign=producthunt-api&utm_medium=api-v2&utm_source=Application%3A+StatisticAPI+%28ID%3A+263803%29>) |
| 22 | [ZIN Advisor](<https://www.producthunt.com/products/zin-advisor?utm_campaign=producthunt-api&utm_medium=api-v2&utm_source=Application%3A+StatisticAPI+%28ID%3A+263803%29>) | Your Cyber Risk Copilot<br><details><summary><strong>Full description</strong></summary><br>ZIN Advisor â€” The Cyber Risk Copilot is a thinking partner built on decision intelligence, designed to evolve with how cyber risk is understood and acted upon. From policy analysis and contextual dashboards to connected insights across your security ecosystem, it transforms complexity into clarity â€” enabling faster, smarter decisions today while shaping how cyber leadership works tomorrow. Use it and let us know your review<br></details> | 54 | 13 | [ğŸ”—](<https://www.producthunt.com/r/4CKJXDGHKI76PY?utm_campaign=producthunt-api&utm_medium=api-v2&utm_source=Application%3A+StatisticAPI+%28ID%3A+263803%29>) |
| 23 | [Surfn](<https://www.producthunt.com/products/surfn?utm_campaign=producthunt-api&utm_medium=api-v2&utm_source=Application%3A+StatisticAPI+%28ID%3A+263803%29>) | Build a conversational AI page for your link in bio &amp; more<br><details><summary><strong>Full description</strong></summary><br>Surfn lets you create conversational AI Pages that drive more engagement and conversions anywhere you share them. Drop them into your socials, newsletters, courses or website to let your AI agent answer questions instantly, capture leads, qualify prospects, book calls, sell products, guide visitors, and turn more traffic into revenue. Use AI Pages as interactive lead magnets, booking agents, AI coaches, course assistants and more. Create your AI Page in under 5 minutes. No code needed.<br></details> | 48 | 12 | [ğŸ”—](<https://www.producthunt.com/r/RWSQAKMBNHTSJU?utm_campaign=producthunt-api&utm_medium=api-v2&utm_source=Application%3A+StatisticAPI+%28ID%3A+263803%29>) |
| 24 | [GRID AI](<https://www.producthunt.com/products/grid-ai-2?utm_campaign=producthunt-api&utm_medium=api-v2&utm_source=Application%3A+StatisticAPI+%28ID%3A+263803%29>) | Your AI that remembers people, conversations, and follow-ups<br><details><summary><strong>Full description</strong></summary><br>GRID AI solves the biggest networking pain point: lost follow-ups and missed opportunities. People meet prospects, exchange cards, and then forget who to call, when to follow up, or what was discussed. GRID AI fixes this by instantly scanning business cards on WhatsApp, saving contacts, adding context with notes, and automating reminders and follow-ups. No spreadsheets, no memory gapsâ€”every lead is tracked, followed up, and converted on time through smart automation.<br></details> | 37 | 3 | [ğŸ”—](<https://www.producthunt.com/r/ZNZSOZ5K7INPWU?utm_campaign=producthunt-api&utm_medium=api-v2&utm_source=Application%3A+StatisticAPI+%28ID%3A+263803%29>) |
| 25 | [RankDots Brand Voice](<https://www.producthunt.com/products/rankdots-2?utm_campaign=producthunt-api&utm_medium=api-v2&utm_source=Application%3A+StatisticAPI+%28ID%3A+263803%29>) | Find topics that rank. Write content in your brand&#x27;s voice.<br><details><summary><strong>Full description</strong></summary><br>RankDots helps you find keyword clusters, structure topical authority, and generate SEO content aligned with real SERPs. Now with Brand Voice, you can tune tone and style â€” so AI content sounds like your brand, not generic AI.<br></details> | 35 | 10 | [ğŸ”—](<https://www.producthunt.com/r/3F4VVRKQQ27SMI?utm_campaign=producthunt-api&utm_medium=api-v2&utm_source=Application%3A+StatisticAPI+%28ID%3A+263803%29>) |
| 26 | [Picsart Aura](<https://www.producthunt.com/products/picsart?utm_campaign=producthunt-api&utm_medium=api-v2&utm_source=Application%3A+StatisticAPI+%28ID%3A+263803%29>) | Delivering Social Content and Short-Form Videos in Minutes<br><details><summary><strong>Full description</strong></summary><br>Ever stare at a blank canvas wondering where to start? Same. That&#x27;s why we built Auraâ€”your AI creative partner that actually gets you. Speak your idea, watch it happen. No prompts to learn, no tools to master. Go from photo to animated video to full campaign in one conversation. Aura remembers your style and keeps getting better. We analyzed 100K+ prompts to make sure it handles what creators actually need. From Picsart, 2.5B downloads strong. Try free â†’ picsart.com/aura<br></details> | 27 | 2 | [ğŸ”—](<https://www.producthunt.com/r/BININX6RTMFZY5?utm_campaign=producthunt-api&utm_medium=api-v2&utm_source=Application%3A+StatisticAPI+%28ID%3A+263803%29>) |
| 27 | [AIvory. Local AI Photo Retouch](<https://www.producthunt.com/products/aivory-ai-photo-retouch?utm_campaign=producthunt-api&utm_medium=api-v2&utm_source=Application%3A+StatisticAPI+%28ID%3A+263803%29>) | Totally local AI photo editing for Mac. Completely Free.<br><details><summary><strong>Full description</strong></summary><br>Product Description AIvory brings studio-quality AI photo editing to your Mac, completely free. Remove unwanted objects, cut out backgrounds, restore old photos, upscale images up to 4x, colorize black and white shots, and fine-tune exposure, contrast, and color, all in seconds. Built natively for macOS, supporting both Apple Silicon and Intel. No subscription, no watermarks, no limits. Just download and start editing.<br></details> | 25 | 1 | [ğŸ”—](<https://www.producthunt.com/r/ENCV4BB4B5AUYJ?utm_campaign=producthunt-api&utm_medium=api-v2&utm_source=Application%3A+StatisticAPI+%28ID%3A+263803%29>) |
| 28 | [ScribeJS â€” Next-Gen Editor Core](<https://www.producthunt.com/products/scribejs-next-gen-editor-core?utm_campaign=producthunt-api&utm_medium=api-v2&utm_source=Application%3A+StatisticAPI+%28ID%3A+263803%29>) | The customizable, open-source core for modern text editors<br><details><summary><strong>Full description</strong></summary><br>Stop fighting with ContentEditable. ScribeJS is a next-gen, open-source framework for building custom text editors without the technical debt. Instead of rigid UI locks, you get a modular core for total control over formatting and plugins. Perfect for SaaS platforms, document tools, and visual builders. This public launch introduces our full framework core, developer documentation, and live examples. Build your editor, your way.<br></details> | 22 | 2 | [ğŸ”—](<https://www.producthunt.com/r/T5YLSXR4OPLIGD?utm_campaign=producthunt-api&utm_medium=api-v2&utm_source=Application%3A+StatisticAPI+%28ID%3A+263803%29>) |
| 29 | [Lissn](<https://www.producthunt.com/products/lissn?utm_campaign=producthunt-api&utm_medium=api-v2&utm_source=Application%3A+StatisticAPI+%28ID%3A+263803%29>) | Voice &amp; video messages for your website visitors<br><details><summary><strong>Full description</strong></summary><br>Lissn is a simple widget that lets website visitors leave voice or video messages instead of filling out boring forms. Perfect for sales teams, support, feedback, or any site wanting more human connections. Pricing starts free ğŸ¤¤<br></details> | 19 | 18 | [ğŸ”—](<https://www.producthunt.com/r/K5OQN5E5XPFR3S?utm_campaign=producthunt-api&utm_medium=api-v2&utm_source=Application%3A+StatisticAPI+%28ID%3A+263803%29>) |
| 30 | [Chapa- Developer Impact, Decoded.](<https://www.producthunt.com/products/chapa-developer-impact-decoded?utm_campaign=producthunt-api&utm_medium=api-v2&utm_source=Application%3A+StatisticAPI+%28ID%3A+263803%29>) | The new way to quantify your impact in AIâ€‘assisted coding.<br><details><summary><strong>Full description</strong></summary><br>Chapa redefines how developers measure impact in the AI era. It analyses your last year of GitHub activity across four dimensionsâ€¯â€”â€¯Building, Guarding, Consistency and Breadthâ€¯â€”â€¯and turns the data into a live, embeddable badge with your archetype, radar chart and heatmap. The badge updates daily, is cryptographically sealed and ready to embed in your README, portfolio, email signature or any website. Try it instantly at chapa.thecreativetoken.com for free today.<br></details> | 16 | 5 | [ğŸ”—](<https://www.producthunt.com/r/NAJ7MO2FRRSTNM?utm_campaign=producthunt-api&utm_medium=api-v2&utm_source=Application%3A+StatisticAPI+%28ID%3A+263803%29>) |
| 31 | [Museum of Handwritten Code](<https://www.producthunt.com/products/museum-of-handwritten-code?utm_campaign=producthunt-api&utm_medium=api-v2&utm_source=Application%3A+StatisticAPI+%28ID%3A+263803%29>) | Relics of brilliance from the hand-crafted era.<br><details><summary><strong>Full description</strong></summary><br>Relics from the era when humans wrote code by hand. Explore iconic building blocks (If, While, Binary Search, Merge Sort) with context and historyâ€”plus optional memorabilia tokens for each exhibit. As AI writes more software (and soon lower-level code), preserve The Original.<br></details> | 15 | 3 | [ğŸ”—](<https://www.producthunt.com/r/HKQJ66VNTALQ5O?utm_campaign=producthunt-api&utm_medium=api-v2&utm_source=Application%3A+StatisticAPI+%28ID%3A+263803%29>) |
| 32 | [Tinkery](<https://www.producthunt.com/products/tinkery?utm_campaign=producthunt-api&utm_medium=api-v2&utm_source=Application%3A+StatisticAPI+%28ID%3A+263803%29>) | The automated data transformation layer for SMBs<br><details><summary><strong>Full description</strong></summary><br>Most SMBs waste time debating numbers they canâ€™t trust. Tinkery fixes that. We transform chaotic, inconsistent data into a single, clean source of truth so teams can plan with confidence, understand what truly drives growth, and act with conviction. With Tinkery, every decision becomes clearerâ€”and every outcome becomes stronger. Today&#x27;s launch marks a completely revamped onboarding and initial project creation experience, improved outcomes and ready-to-use marketing and sales use cases.<br></details> | 14 | 2 | [ğŸ”—](<https://www.producthunt.com/r/R3JN5B7KJ5PMQG?utm_campaign=producthunt-api&utm_medium=api-v2&utm_source=Application%3A+StatisticAPI+%28ID%3A+263803%29>) |
| 33 | [ActorRise](<https://www.producthunt.com/products/actorrise?utm_campaign=producthunt-api&utm_medium=api-v2&utm_source=Application%3A+StatisticAPI+%28ID%3A+263803%29>) | Find the perfect monologue in less than 20 seconds<br><details><summary><strong>Full description</strong></summary><br>Actors waste 6+ hours reading plays to find one monologue. ActorRise finds the perfect piece in under 20 seconds using AI search across the world&#x27;s largest database (8,600+ monologues vs competitors&#x27; 1,100). Just describe what you need: &#x27;funny piece for woman in 20s about family drama.&#x27; or even type in a quote &quot;To be or not to be&quot; ActorRise will find your monologue. Built by a working actor who got tired of wasting time on libraries, old books and tiny databases.. Free tier available.<br></details> | 13 | 6 | [ğŸ”—](<https://www.producthunt.com/r/LXWH5TTOQO3B2M?utm_campaign=producthunt-api&utm_medium=api-v2&utm_source=Application%3A+StatisticAPI+%28ID%3A+263803%29>) |
| 34 | [fixAIcode](<https://www.producthunt.com/products/fixaicode?utm_campaign=producthunt-api&utm_medium=api-v2&utm_source=Application%3A+StatisticAPI+%28ID%3A+263803%29>) | Ship Faster. Fix Smarter.<br><details><summary><strong>Full description</strong></summary><br>AI coding assistants make you faster. They also introduce security holes, performance issues, and architectural debt that pass tests but break in production. fixAIcode connects to your GitHub repo and scores it across security, code quality, performance, and architecture. Every issue includes file paths, impact explanation, and code snippet proof. Each issue has a &quot;Generate Prompt&quot; button - get a ready-to-use prompt to fix it with agent. Or let our dev team handle the fixes for you.<br></details> | 12 | 1 | [ğŸ”—](<https://www.producthunt.com/r/4SUXAA7C3OH6IR?utm_campaign=producthunt-api&utm_medium=api-v2&utm_source=Application%3A+StatisticAPI+%28ID%3A+263803%29>) |
| 35 | [BrowserPod for Node.js](<https://www.producthunt.com/products/browserpod-for-node-js?utm_campaign=producthunt-api&utm_medium=api-v2&utm_source=Application%3A+StatisticAPI+%28ID%3A+263803%29>) | Run AI code safely in a browser-based serverless sandbox.<br><details><summary><strong>Full description</strong></summary><br>BrowserPod for Node.js runs untrusted code, such as that generated by AI agents, within an in-browser, sandboxed Node runtime called a Pod. Pods have high fidelity with native Node.js, and come with a virtual filesystem, multiprocess support, and Portals - public URLs for shareable previews. With BrowserPod, you can build agentic tools and web IDEs without server side compute. Node.js is the first runtime engine for BrowserPod, a language-agnostic, universal execution layer for the browser.<br></details> | 11 | 4 | [ğŸ”—](<https://www.producthunt.com/r/63QBBHILCU2MOA?utm_campaign=producthunt-api&utm_medium=api-v2&utm_source=Application%3A+StatisticAPI+%28ID%3A+263803%29>) |
| 36 | [Slackoff](<https://www.producthunt.com/products/slackoff?utm_campaign=producthunt-api&utm_medium=api-v2&utm_source=Application%3A+StatisticAPI+%28ID%3A+263803%29>) | Never return from vacation to Slack chaos again.<br><details><summary><strong>Full description</strong></summary><br>Ever returned from vacation to 50+ Slack notifications with zero clue what&#x27;s urgent? Slackoff solves this. When you&#x27;re on leave, teammates mark messages High or Low priority. High = backup contact shown immediately. Low = logged for later. You return to a clean, organized summary (urgent first, noise grouped separately) instead of spending 2 hours sorting chaos. Self-hosted ($99 lifetime), your data never leaves your servers. Built by a designer who got tired of leave anxiety.<br></details> | 10 | 7 | [ğŸ”—](<https://www.producthunt.com/r/4AB76XTPME3RXZ?utm_campaign=producthunt-api&utm_medium=api-v2&utm_source=Application%3A+StatisticAPI+%28ID%3A+263803%29>) |
| 37 | [Huntopic](<https://www.producthunt.com/products/huntopic?utm_campaign=producthunt-api&utm_medium=api-v2&utm_source=Application%3A+StatisticAPI+%28ID%3A+263803%29>) | AI that finds customers for you on Reddit<br><details><summary><strong>Full description</strong></summary><br>Get instant alerts whenever someone on Reddit asks for a solution like yours. Huntopic monitors the platform 24/7 and uses 3-layer AI to filter thousands of discussions by real buying intent. Arrive early, engage the lead, and secure a privileged spot in the top comments. Stop scrolling, multiply your sales, and save 30+ hours every week.<br></details> | 9 | 3 | [ğŸ”—](<https://www.producthunt.com/r/JIDFUN6GPP5SXV?utm_campaign=producthunt-api&utm_medium=api-v2&utm_source=Application%3A+StatisticAPI+%28ID%3A+263803%29>) |
| 38 | [HabitBit](<https://www.producthunt.com/products/habitbit?utm_campaign=producthunt-api&utm_medium=api-v2&utm_source=Application%3A+StatisticAPI+%28ID%3A+263803%29>) | Ridiculously simple habit tracking for your iPhone<br><details><summary><strong>Full description</strong></summary><br>Tired of habit apps with paywall pop-ups every 5 seconds? HabitBit: Ridiculously simple habit tracking for your iPhone. Track from lock screen widgets or home page widgets. - Add habits in 10 seconds - Track from lock screen widgets - Grid-based visualization that lets you track weekly/monthly/yearly. - No paywall spam You unlock your phone 100+ times/day. See your progress every time. Free version actually works. Premium adds unlimited habits and advanced stats.<br></details> | 7 | 7 | [ğŸ”—](<https://www.producthunt.com/r/FINZDD6IDATVUE?utm_campaign=producthunt-api&utm_medium=api-v2&utm_source=Application%3A+StatisticAPI+%28ID%3A+263803%29>) |
| 39 | [LucidClip](<https://www.producthunt.com/products/lucidclip?utm_campaign=producthunt-api&utm_medium=api-v2&utm_source=Application%3A+StatisticAPI+%28ID%3A+263803%29>) | Privacy-first clipboard manager that runs entirely locally<br><details><summary><strong>Full description</strong></summary><br>LucidClip is a native, privacy-first clipboard manager for macOS and desktop platforms. It stores everything locally, gives you full control over retention and exclusions, and lets you instantly access your clipboard history. No cloud. No tracking. Your data stays on your device.<br></details> | 7 | 1 | [ğŸ”—](<https://www.producthunt.com/r/DAYH7A3PC73YEX?utm_campaign=producthunt-api&utm_medium=api-v2&utm_source=Application%3A+StatisticAPI+%28ID%3A+263803%29>) |
| 40 | [BeSpoke AI Stylist](<https://www.producthunt.com/products/bespoke-ai-stylist-early-access?utm_campaign=producthunt-api&utm_medium=api-v2&utm_source=Application%3A+StatisticAPI+%28ID%3A+263803%29>) | On a mission to style 1 Billion people with AI<br><details><summary><strong>Full description</strong></summary><br>BeSpoke AI Stylist is a context aware AI styling system built around your real closet and daily schedule. It organizes your wardrobe, plans outfits against your calendar, and adapts recommendations based on weather, location, and occasion. Instead of pushing trends, it focuses on structured decision making. You can interact with stylist, designer, and shopping advisor modes in one unified platform.<br></details> | 7 | 1 | [ğŸ”—](<https://www.producthunt.com/r/APTXJY6K576JGZ?utm_campaign=producthunt-api&utm_medium=api-v2&utm_source=Application%3A+StatisticAPI+%28ID%3A+263803%29>) |
| 41 | [BareUptime](<https://www.producthunt.com/products/bareuptime?utm_campaign=producthunt-api&utm_medium=api-v2&utm_source=Application%3A+StatisticAPI+%28ID%3A+263803%29>) | Enterprise monitoring power, startup-friendly pricing<br><details><summary><strong>Full description</strong></summary><br>AI-powered uptime monitoring for websites, APIs &amp; email - SSL certificate checks &amp; expiry alerts - Content / keyword validation - Real-time downtime alerts - Infrastructure monitoring - Email monitoring (SPF, DKIM, DMARC)<br></details> | 7 | 1 | [ğŸ”—](<https://www.producthunt.com/r/2J67TPLEG2FP5W?utm_campaign=producthunt-api&utm_medium=api-v2&utm_source=Application%3A+StatisticAPI+%28ID%3A+263803%29>) |
| 42 | [The Tank: Collective AI](<https://www.producthunt.com/products/the-tank-collective-ai?utm_campaign=producthunt-api&utm_medium=api-v2&utm_source=Application%3A+StatisticAPI+%28ID%3A+263803%29>) | One chat. Many AI models. Better answers.<br><details><summary><strong>Full description</strong></summary><br>Stop tab-hopping. The Tank is one chat with a whole AI bench. Ask once, it routes your prompt to the best model(s) and returns a single, high-quality answerâ€”so you keep momentum instead of juggling tools.<br></details> | 6 | 0 | [ğŸ”—](<https://www.producthunt.com/r/2VP7YQMEIETKG2?utm_campaign=producthunt-api&utm_medium=api-v2&utm_source=Application%3A+StatisticAPI+%28ID%3A+263803%29>) |
| 43 | [Rehit.ai](<https://www.producthunt.com/products/rehit-ai?utm_campaign=producthunt-api&utm_medium=api-v2&utm_source=Application%3A+StatisticAPI+%28ID%3A+263803%29>) | Recreate Viral Success on Instagram in seconds<br><details><summary><strong>Full description</strong></summary><br>Rehit analyzes why Instagram videos go viral and helps you replicate them in your niche. It detects content that truly outperformed regardless of audience size, breaks down its viral anatomy (hook, narrative, CTA) and rewrites scripts adapted to your voice learning from your own profile and videos over time. Monitor 20 competitors 24/7 with Spy Agent and get alerts when they go viral.<br></details> | 6 | 2 | [ğŸ”—](<https://www.producthunt.com/r/JJYEO6DFJLME77?utm_campaign=producthunt-api&utm_medium=api-v2&utm_source=Application%3A+StatisticAPI+%28ID%3A+263803%29>) |
| 44 | [MineDemo](<https://www.producthunt.com/products/minedemo?utm_campaign=producthunt-api&utm_medium=api-v2&utm_source=Application%3A+StatisticAPI+%28ID%3A+263803%29>) | Screen Recorder with Fun Walking Avatar<br><details><summary><strong>Full description</strong></summary><br>Hi All! Minedemo is fun tool that allow you to literally walking on your demo with an avatar layer on top of any shared screen or link. You can also add decors like hearts, and poops on to it. Currently: - Supports embed website (google doc and slides too), screen mirroring - Fully local storage - Supports both landscape and portrait mode - 10+ avatars - 10+ decor / objects -Totally Free (but open to coffee if you more avatar/decor =) Looking forward to connecting with everyone on X<br></details> | 6 | 1 | [ğŸ”—](<https://www.producthunt.com/r/IZZKBIDONUZCLM?utm_campaign=producthunt-api&utm_medium=api-v2&utm_source=Application%3A+StatisticAPI+%28ID%3A+263803%29>) |
| 45 | [ShipMyBlog.com](<https://www.producthunt.com/products/shipmyblog-com-bootstrapped-product?utm_campaign=producthunt-api&utm_medium=api-v2&utm_source=Application%3A+StatisticAPI+%28ID%3A+263803%29>) | Write, Host and Index your blogs instantly<br><details><summary><strong>Full description</strong></summary><br>Launch a fully hosted, AIâ€‘written blog in under 60 seconds. Hassle free hosting. No plugins. No writing. Index instantly on major Search and AI engines. Fully free too use except AI features. Includes: Custom domains Blog Generation Image Generation Blog Research Instant Indexing Much more...<br></details> | 6 | 2 | [ğŸ”—](<https://www.producthunt.com/r/2XKTBJMUZZGOCU?utm_campaign=producthunt-api&utm_medium=api-v2&utm_source=Application%3A+StatisticAPI+%28ID%3A+263803%29>) |
| 46 | [Lumary Recorder](<https://www.producthunt.com/products/lumary-recorder?utm_campaign=producthunt-api&utm_medium=api-v2&utm_source=Application%3A+StatisticAPI+%28ID%3A+263803%29>) | Capture screen, camera, mic, and system audio in one take.<br><details><summary><strong>Full description</strong></summary><br>Record your screen, camera, microphone, and system audio simultaneously. Each is saved as its own file for full editing control. Or combine them into a single picture-in-picture composition with custom scenes. ProRes &amp; HEVC with hardware encoding. On-device transcription with SRT/VTT export. Crash recovery that saves your footage in case of any issues. No cloud. No account. No subscription. Everything stays on your Mac.<br></details> | 5 | 1 | [ğŸ”—](<https://www.producthunt.com/r/AESK2PK22L2YUX?utm_campaign=producthunt-api&utm_medium=api-v2&utm_source=Application%3A+StatisticAPI+%28ID%3A+263803%29>) |
| 47 | [Bookmark Cleaner](<https://www.producthunt.com/products/bookmark-cleaner?utm_campaign=producthunt-api&utm_medium=api-v2&utm_source=Application%3A+StatisticAPI+%28ID%3A+263803%29>) | Find and delete dead bookmarks in one click<br><details><summary><strong>Full description</strong></summary><br>How many of your bookmarks still work? Probably fewer than you think. Bookmark Cleaner scans every bookmark in your browser, detects dead links â€” 404s, timeouts, server errors â€” and lets you review and delete them in bulk. One-click scan of your entire bookmark library Review dead links before deleting â€” nothing is removed without your approval Zero data collection. Nothing leaves your browser. Ever. Lightweight. Vanilla JS. No frameworks, no bloat. Free and open source.<br></details> | 5 | 1 | [ğŸ”—](<https://www.producthunt.com/r/LI27QR7TTF7PB4?utm_campaign=producthunt-api&utm_medium=api-v2&utm_source=Application%3A+StatisticAPI+%28ID%3A+263803%29>) |
| 48 | [Background Remover â€“ Chrome Extension](<https://www.producthunt.com/products/background-remover-chrome-extension?utm_campaign=producthunt-api&utm_medium=api-v2&utm_source=Application%3A+StatisticAPI+%28ID%3A+263803%29>) | One-click background removal â€” right in your browser tab<br><details><summary><strong>Full description</strong></summary><br>Drop any image, preview the cutout, export transparent image in seconds. Remove bg from any visual. Perfect for product shots, social assets, portraits, stickers, and more â€” all without leaving Chrome.<br></details> | 5 | 1 | [ğŸ”—](<https://www.producthunt.com/r/NMNA2XEFMCIJHI?utm_campaign=producthunt-api&utm_medium=api-v2&utm_source=Application%3A+StatisticAPI+%28ID%3A+263803%29>) |
| 49 | [VIDI â€” AI Contract Review](<https://www.producthunt.com/products/vidi-ai-contract-review?utm_campaign=producthunt-api&utm_medium=api-v2&utm_source=Application%3A+StatisticAPI+%28ID%3A+263803%29>) | AI that reviews contracts instantly and detects legal risks<br><details><summary><strong>Full description</strong></summary><br>VIDI is an AI-powered contract analysis platform for US small businesses. It instantly reviews contracts, detects legal risks, explains complex clauses in plain English, and suggests safer revisions. VIDI helps companies understand agreements without expensive lawyers, reducing costs and preventing legal mistakes. Built by a solo technical founder, VIDI focuses on speed and accessibility.<br></details> | 5 | 3 | [ğŸ”—](<https://www.producthunt.com/r/G2PHV65TJHYMFF?utm_campaign=producthunt-api&utm_medium=api-v2&utm_source=Application%3A+StatisticAPI+%28ID%3A+263803%29>) |
| 50 | [Metriqual](<https://www.producthunt.com/products/metriqual?utm_campaign=producthunt-api&utm_medium=api-v2&utm_source=Application%3A+StatisticAPI+%28ID%3A+263803%29>) | One proxy. Smarter AI usage.<br><details><summary><strong>Full description</strong></summary><br>Metriqual is a lightweight middleware that sits between your app and LLMs to make AI usage predictable. Route simple tasks to cheaper models, cache repeated requests, track cost per user or feature, and set budgets before bills get out of hand. Built for indie hackers and early-stage teams shipping real GenAI apps.<br></details> | 5 | 1 | [ğŸ”—](<https://www.producthunt.com/r/IWTIPAVQWRBNJR?utm_campaign=producthunt-api&utm_medium=api-v2&utm_source=Application%3A+StatisticAPI+%28ID%3A+263803%29>) |
| 51 | [Mitra AI](<https://www.producthunt.com/products/mitra-ai?utm_campaign=producthunt-api&utm_medium=api-v2&utm_source=Application%3A+StatisticAPI+%28ID%3A+263803%29>) | The AI Sales Agent that turns browsers into buyers. (24/7)<br><details><summary><strong>Full description</strong></summary><br>Stop losing sales while you sleep. Mitra AI is a 24/7 sales assistant for Shopify &amp; WooCommerce that understands customer intent, recommends products like a pro, and recovers abandoned carts instantly. Setup in 5 minutes. No code required<br></details> | 5 | 1 | [ğŸ”—](<https://www.producthunt.com/r/SRGPZ6JQJ2C3VA?utm_campaign=producthunt-api&utm_medium=api-v2&utm_source=Application%3A+StatisticAPI+%28ID%3A+263803%29>) |
| 52 | [book2course](<https://www.producthunt.com/products/book2course-2?utm_campaign=producthunt-api&utm_medium=api-v2&utm_source=Application%3A+StatisticAPI+%28ID%3A+263803%29>) | Turn long books into fully structured courses using AI<br><details><summary><strong>Full description</strong></summary><br>Upload any PDF textbook or notes. Book2Course uses AI to transform it into a structured course with chapters, lessons, quizzes, spaced repetition flashcards, an AI tutor, and knowledge maps. Each lesson includes explanations, examples, key concepts, and inline checks. Quizzes adapt across 4 difficulty levels. Flashcards use spaced repetition to maximize retention. Try it out for free now.<br></details> | 5 | 4 | [ğŸ”—](<https://www.producthunt.com/r/JH6KCP6HVLL7AQ?utm_campaign=producthunt-api&utm_medium=api-v2&utm_source=Application%3A+StatisticAPI+%28ID%3A+263803%29>) |
| 53 | [SketchVibe](<https://www.producthunt.com/products/sketchvibe-talk-to-llms-the-right-way?utm_campaign=producthunt-api&utm_medium=api-v2&utm_source=Application%3A+StatisticAPI+%28ID%3A+263803%29>) | open-source AI chat that renders responses as visual blocks<br><details><summary><strong>Full description</strong></summary><br>ğŸ¨ Free, open-source AI chat that renders responses as visual blocks â€” cards, charts, tables &amp; more. Local-first, BYOK (OpenAI, Anthropic, Gemini, Grok), voice chat, web search, file uploads. All data stays in your browser.<br></details> | 5 | 1 | [ğŸ”—](<https://www.producthunt.com/r/ZM24XVI4I6WWN7?utm_campaign=producthunt-api&utm_medium=api-v2&utm_source=Application%3A+StatisticAPI+%28ID%3A+263803%29>) |
| 54 | [DOOMSCROLLR](<https://www.producthunt.com/products/doomscrollr?utm_campaign=producthunt-api&utm_medium=api-v2&utm_source=Application%3A+StatisticAPI+%28ID%3A+263803%29>) | Raw expression. Direct-to-fan growth. No algorithm bullshit.<br><details><summary><strong>Full description</strong></summary><br>Share anything. Curate everything. Your people. Your world. Your rules.<br></details> | 4 | 3 | [ğŸ”—](<https://www.producthunt.com/r/Y6NIXDAZFIYGGV?utm_campaign=producthunt-api&utm_medium=api-v2&utm_source=Application%3A+StatisticAPI+%28ID%3A+263803%29>) |
| 55 | [KnotenWerk](<https://www.producthunt.com/products/knotenwerk?utm_campaign=producthunt-api&utm_medium=api-v2&utm_source=Application%3A+StatisticAPI+%28ID%3A+263803%29>) | Your granddad&#x27;s UI design for simple trees and graphs<br><details><summary><strong>Full description</strong></summary><br>KnotenWerk is a no-distraction tool for interactive decision trees and graphs with Edit and View/Demo modes, local-first JSON files, and JSON/SVG/Markdown export. Build interactive decision trees and graphs in Edit Mode, then click through outcomes in View/Demo Mode before shipping your solution.<br></details> | 4 | 1 | [ğŸ”—](<https://www.producthunt.com/r/XEQ4ACYY4TWY6H?utm_campaign=producthunt-api&utm_medium=api-v2&utm_source=Application%3A+StatisticAPI+%28ID%3A+263803%29>) |
| 56 | [Page2Play](<https://www.producthunt.com/products/page2play?utm_campaign=producthunt-api&utm_medium=api-v2&utm_source=Application%3A+StatisticAPI+%28ID%3A+263803%29>) | Text stories to videos with no prompt or animation skills.<br><details><summary><strong>Full description</strong></summary><br>You paste your complete story, AI handles everything - Analyzes your narrative - Breaks it into scenes automatically - Determines camera angles - Creates everything coherently &quot;You&#x27;re a storyteller, not a prompt engineer.&quot;<br></details> | 4 | 1 | [ğŸ”—](<https://www.producthunt.com/r/2K4NPN2NE7DSA4?utm_campaign=producthunt-api&utm_medium=api-v2&utm_source=Application%3A+StatisticAPI+%28ID%3A+263803%29>) |
| 57 | [Sous](<https://www.producthunt.com/products/sous-extract-recipes-from-videos?utm_campaign=producthunt-api&utm_medium=api-v2&utm_source=Application%3A+StatisticAPI+%28ID%3A+263803%29>) | Cook what you watch. Share what you make.<br><details><summary><strong>Full description</strong></summary><br>Most recipe apps focus on storing curated recipes â€” a problem thatâ€™s already solved. Sous addresses a different gap: turning YouTube cooking videos into something you can actually cook from. Sous extracts ingredients, steps, and timestamps from YouTube cooking video â€” then guides you through each step with the video synced, auto-generates your grocery list, and creates a shareable link. Sous doesnâ€™t replace recipe apps â€” it transforms passive video watching into a practical cooking workflow.<br></details> | 4 | 1 | [ğŸ”—](<https://www.producthunt.com/r/D2GJAD5ITRTBS6?utm_campaign=producthunt-api&utm_medium=api-v2&utm_source=Application%3A+StatisticAPI+%28ID%3A+263803%29>) |
| 58 | [loved.chat](<https://www.producthunt.com/products/loved-chat?utm_campaign=producthunt-api&utm_medium=api-v2&utm_source=Application%3A+StatisticAPI+%28ID%3A+263803%29>) | Turn your memories into something beautiful<br><details><summary><strong>Full description</strong></summary><br>Turn your favorite memories into an interactive story board you can gift for birthdays, anniversaries, weddings and other special moments.<br></details> | 4 | 1 | [ğŸ”—](<https://www.producthunt.com/r/JA7ZY5HD36MHBE?utm_campaign=producthunt-api&utm_medium=api-v2&utm_source=Application%3A+StatisticAPI+%28ID%3A+263803%29>) |
| 59 | [Pulse](<https://www.producthunt.com/products/pulse-29?utm_campaign=producthunt-api&utm_medium=api-v2&utm_source=Application%3A+StatisticAPI+%28ID%3A+263803%29>) | Collect voice feedback with QR in minutes<br><details><summary><strong>Full description</strong></summary><br>QR-based voice feedback with instant transcription and saved audio. Limited time: 3 free pulses for new businesses.<br></details> | 4 | 1 | [ğŸ”—](<https://www.producthunt.com/r/QJIMB5UBYZFHNB?utm_campaign=producthunt-api&utm_medium=api-v2&utm_source=Application%3A+StatisticAPI+%28ID%3A+263803%29>) |
| 60 | [OutfitVideo](<https://www.producthunt.com/products/outfitvideo?utm_campaign=producthunt-api&utm_medium=api-v2&utm_source=Application%3A+StatisticAPI+%28ID%3A+263803%29>) | Transform Outfit Images into Stunning Videos<br><details><summary><strong>Full description</strong></summary><br>Transform outfit photos into stunning short-form videos. Generate professional, AI-powered TikTok, Instagram Reels, and YouTube Shorts videos in seconds. Free trial with 5 credits, no credit card required.<br></details> | 4 | 1 | [ğŸ”—](<https://www.producthunt.com/r/RDNGC6JDGPNJKO?utm_campaign=producthunt-api&utm_medium=api-v2&utm_source=Application%3A+StatisticAPI+%28ID%3A+263803%29>) |
| 61 | [Nibi](<https://www.producthunt.com/products/nibi?utm_campaign=producthunt-api&utm_medium=api-v2&utm_source=Application%3A+StatisticAPI+%28ID%3A+263803%29>) | Run your empire as a freelancer<br><details><summary><strong>Full description</strong></summary><br>From expense tracker to full freelance finance suite â€” in 4 months. New since v1.0: invoicing &amp; client management, tax export, deduction tips by category, profit insights, transaction search, and a complete redesign. Coming: AI billing assistant, FHSA/RRSP guidance, smart notifications. iOS. Privacy-first. $6.99/month ğŸ‡¨ğŸ‡¦ $69.99/year ğŸ‡¨ğŸ‡¦ $99.99 Lifetime<br></details> | 4 | 1 | [ğŸ”—](<https://www.producthunt.com/r/4V4ZTKIWQKEYMU?utm_campaign=producthunt-api&utm_medium=api-v2&utm_source=Application%3A+StatisticAPI+%28ID%3A+263803%29>) |
| 62 | [MediaTools](<https://www.producthunt.com/products/mediatools-2?utm_campaign=producthunt-api&utm_medium=api-v2&utm_source=Application%3A+StatisticAPI+%28ID%3A+263803%29>) | Free, ad-free video downloader for TikTok, X &amp; Facebook<br><details><summary><strong>Full description</strong></summary><br>MediaTools is the cleanest way to download social media videos. Save TikToks without watermarks, extract audio as MP3, and download from Twitter/X and Facebook all in HD, completely free. No app installs, no pop-up ads, no login required. Built for everyone who are tired of sketchy download sites. Works perfectly on iPhone, Android, Mac, and PC.<br></details> | 4 | 1 | [ğŸ”—](<https://www.producthunt.com/r/6EWQEYFIWH62S4?utm_campaign=producthunt-api&utm_medium=api-v2&utm_source=Application%3A+StatisticAPI+%28ID%3A+263803%29>) |
| 63 | [GrokBox](<https://www.producthunt.com/products/grokbox?utm_campaign=producthunt-api&utm_medium=api-v2&utm_source=Application%3A+StatisticAPI+%28ID%3A+263803%29>) | Download Bulk AI-generated videos from Grok with one click.<br><details><summary><strong>Full description</strong></summary><br>Download AI-generated videos from Grok chats GrokBox â€” Download AI-generated videos from Grok with one click. Select and download AI-generated videos directly from grok.com and x.com/i/grok. No scanning, no hassle â€” just hover, select, and download.<br></details> | 4 | 1 | [ğŸ”—](<https://www.producthunt.com/r/IKWWFLRXA7P6YO?utm_campaign=producthunt-api&utm_medium=api-v2&utm_source=Application%3A+StatisticAPI+%28ID%3A+263803%29>) |
| 64 | [Pulse](<https://www.producthunt.com/products/pulse-29?utm_campaign=producthunt-api&utm_medium=api-v2&utm_source=Application%3A+StatisticAPI+%28ID%3A+263803%29>) | Collect voice feedback with QR in minutes<br><details><summary><strong>Full description</strong></summary><br>QR-based voice feedback with instant transcription and saved audio. Limited time: 3 free pulses for new businesses.<br></details> | 4 | 1 | [ğŸ”—](<https://www.producthunt.com/r/QJIMB5UBYZFHNB?utm_campaign=producthunt-api&utm_medium=api-v2&utm_source=Application%3A+StatisticAPI+%28ID%3A+263803%29>) |
| 65 | [Free Up](<https://www.producthunt.com/products/free-up-2?utm_campaign=producthunt-api&utm_medium=api-v2&utm_source=Application%3A+StatisticAPI+%28ID%3A+263803%29>) | The fast, native macOS storage cleaner<br><details><summary><strong>Full description</strong></summary><br>FreeUp is a native macOS storage cleaner that finds duplicates, caches, system junk, and forgotten files eating your disk space. Built with Swift and SwiftUI, it scans your entire drive in seconds; not minutes. Select what to remove, preview before you delete, and reclaim gigabytes instantly. No subscriptions, no bloat, no Electron wrapper. Just a fast, lightweight tool that looks and feels like it belongs on your Mac. Built by Mecury Labs.<br></details> | 4 | 1 | [ğŸ”—](<https://www.producthunt.com/r/N7D7BOEDTF3ICG?utm_campaign=producthunt-api&utm_medium=api-v2&utm_source=Application%3A+StatisticAPI+%28ID%3A+263803%29>) |
| 66 | [Fidopics](<https://www.producthunt.com/products/fidopics?utm_campaign=producthunt-api&utm_medium=api-v2&utm_source=Application%3A+StatisticAPI+%28ID%3A+263803%29>) | Your Product, Faithfully Featured in Every Scene<br><details><summary><strong>Full description</strong></summary><br>Product Photography, Simplified. Stop struggling with expensive studios or complex apps that get your product wrong. Fidopics gives you professional, high-converting photos for Amazon, Etsy, and social media in seconds. Your Product, Perfected We achieve over 90% accuracy in replicating your product&#x27;s details and textâ€”far surpassing standard AI tools. While no technology is perfect, our specialized engine ensures your brand looks right, the vast majority of the time.<br></details> | 4 | 1 | [ğŸ”—](<https://www.producthunt.com/r/3NYKPJ53NVZUM5?utm_campaign=producthunt-api&utm_medium=api-v2&utm_source=Application%3A+StatisticAPI+%28ID%3A+263803%29>) |
| 67 | [loved.chat](<https://www.producthunt.com/products/loved-chat?utm_campaign=producthunt-api&utm_medium=api-v2&utm_source=Application%3A+StatisticAPI+%28ID%3A+263803%29>) | Turn your memories into something beautiful<br><details><summary><strong>Full description</strong></summary><br>Turn your favorite memories into an interactive story board you can gift for birthdays, anniversaries, weddings and other special moments.<br></details> | 4 | 1 | [ğŸ”—](<https://www.producthunt.com/r/JA7ZY5HD36MHBE?utm_campaign=producthunt-api&utm_medium=api-v2&utm_source=Application%3A+StatisticAPI+%28ID%3A+263803%29>) |
| 68 | [CuriobitÂ®](<https://www.producthunt.com/products/curiobit?utm_campaign=producthunt-api&utm_medium=api-v2&utm_source=Application%3A+StatisticAPI+%28ID%3A+263803%29>) | The book that comes alive<br><details><summary><strong>Full description</strong></summary><br>An illustrated encyclopedia that comes alive. Kids read the book, scan a QR code, and unlock AI-powered AR experiences â€” controlled entirely by hand gestures. âœ“ 100+ pages, 20+ topics, ages 6-14 âœ“ Touchless gesture navigation âœ“ Voice AI journal &amp; planner âœ“ Built-in healthy screen-time breaks âœ“ No app download needed Physical book meets AI magic.<br></details> | 4 | 1 | [ğŸ”—](<https://www.producthunt.com/r/4DNEX657N2G4SU?utm_campaign=producthunt-api&utm_medium=api-v2&utm_source=Application%3A+StatisticAPI+%28ID%3A+263803%29>) |
| 69 | [Palabrify](<https://www.producthunt.com/products/palabrify?utm_campaign=producthunt-api&utm_medium=api-v2&utm_source=Application%3A+StatisticAPI+%28ID%3A+263803%29>) | Learn vocab from your real-life context<br><details><summary><strong>Full description</strong></summary><br>Master Spanish, English, and more with Palabrify. The AI-powered language learning app featuring smart flashcards, spaced repetition, and grammar drills. Download for iOS.<br></details> | 4 | 1 | [ğŸ”—](<https://www.producthunt.com/r/3LMQN5TJ5DJSIV?utm_campaign=producthunt-api&utm_medium=api-v2&utm_source=Application%3A+StatisticAPI+%28ID%3A+263803%29>) |
| 70 | [Stellar](<https://www.producthunt.com/products/stellar-6?utm_campaign=producthunt-api&utm_medium=api-v2&utm_source=Application%3A+StatisticAPI+%28ID%3A+263803%29>) | Starship prompt theme manager<br><details><summary><strong>Full description</strong></summary><br>Stellar is a theme manger for starship prompts. You can easily switch between your local starship configs, or get &amp; switch between community themes<br></details> | 4 | 1 | [ğŸ”—](<https://www.producthunt.com/r/NSVBAOWES4ZJJP?utm_campaign=producthunt-api&utm_medium=api-v2&utm_source=Application%3A+StatisticAPI+%28ID%3A+263803%29>) |
| 71 | [InstantReply](<https://www.producthunt.com/products/instantreply-fully-automated-ai-cs?utm_campaign=producthunt-api&utm_medium=api-v2&utm_source=Application%3A+StatisticAPI+%28ID%3A+263803%29>) | Orders, shipping, refunds, and FAQs - handled automatically.<br><details><summary><strong>Full description</strong></summary><br>Shopify stores spend hours every week answering the same support questions. Order status, shipping updates, address changes, refunds, and even up-sell opportunities if configured. InstantReply is a fully automated support agent that taps in to your Shopify store and resolves these requests without human involvement<br></details> | 4 | 1 | [ğŸ”—](<https://www.producthunt.com/r/H373FLRN7X74T5?utm_campaign=producthunt-api&utm_medium=api-v2&utm_source=Application%3A+StatisticAPI+%28ID%3A+263803%29>) |
| 72 | [OutfitVideo](<https://www.producthunt.com/products/outfitvideo?utm_campaign=producthunt-api&utm_medium=api-v2&utm_source=Application%3A+StatisticAPI+%28ID%3A+263803%29>) | Transform Outfit Images into Stunning Videos<br><details><summary><strong>Full description</strong></summary><br>Transform outfit photos into stunning short-form videos. Generate professional, AI-powered TikTok, Instagram Reels, and YouTube Shorts videos in seconds. Free trial with 5 credits, no credit card required.<br></details> | 4 | 1 | [ğŸ”—](<https://www.producthunt.com/r/RDNGC6JDGPNJKO?utm_campaign=producthunt-api&utm_medium=api-v2&utm_source=Application%3A+StatisticAPI+%28ID%3A+263803%29>) |
| 73 | [Sencity](<https://www.producthunt.com/products/sencity?utm_campaign=producthunt-api&utm_medium=api-v2&utm_source=Application%3A+StatisticAPI+%28ID%3A+263803%29>) | The digital twin of your physical product<br><details><summary><strong>Full description</strong></summary><br>Sencity connects every device with its user through an AI-powered digital twin â€” built for products that demand regular maintenance, continuous readiness, and dependable performance.<br></details> | 4 | 1 | [ğŸ”—](<https://www.producthunt.com/r/OH5SWCX2DNWIJA?utm_campaign=producthunt-api&utm_medium=api-v2&utm_source=Application%3A+StatisticAPI+%28ID%3A+263803%29>) |
| 74 | [mcp-fusion](<https://www.producthunt.com/products/mcp-fusion?utm_campaign=producthunt-api&utm_medium=api-v2&utm_source=Application%3A+StatisticAPI+%28ID%3A+263803%29>) | Route 5,000+ AI tools into one. Stop LLM context bloat.<br><details><summary><strong>Full description</strong></summary><br>Standard MCP breaks at scale. Exposing 50+ tools to Claude or Cursor destroys the context window, skyrockets API token costs, and causes routing hallucinations. mcp-fusion is an open-source TS gateway that multiplexes thousands of endpoints into ONE mathematically perfect tool. Stop burning tokens. Ship one tool.<br></details> | 4 | 1 | [ğŸ”—](<https://www.producthunt.com/r/TPYC6HN7AVZVOC?utm_campaign=producthunt-api&utm_medium=api-v2&utm_source=Application%3A+StatisticAPI+%28ID%3A+263803%29>) |
| 75 | [B2B SaaS Lead Generation](<https://www.producthunt.com/products/b2b-saas-lead-generation?utm_campaign=producthunt-api&utm_medium=api-v2&utm_source=Application%3A+StatisticAPI+%28ID%3A+263803%29>) | The referral replacement system for B2B businesses<br><details><summary><strong>Full description</strong></summary><br>BuzzLead builds cold email infrastructure that replaces referral-dependent pipelines. We&#x27;ve booked 2,000+ meetings for 50+ clients â€” without SDR teams, without cold callers, just systems.<br></details> | 4 | 1 | [ğŸ”—](<https://www.producthunt.com/r/BR6EDBZH37KGJ2?utm_campaign=producthunt-api&utm_medium=api-v2&utm_source=Application%3A+StatisticAPI+%28ID%3A+263803%29>) |
| 76 | [Structs](<https://www.producthunt.com/products/structs?utm_campaign=producthunt-api&utm_medium=api-v2&utm_source=Application%3A+StatisticAPI+%28ID%3A+263803%29>) | From raw text to structured JSON available as MCP Tools<br><details><summary><strong>Full description</strong></summary><br>Structs uses AI to extract structured data from any text, then turn it into dynamic visualizations â€” all from a single schema. Generate sample dataset from your json schema and create simple DataViz Structs allow you to store structured data available as MCP Tools to reuse in any context.<br></details> | 4 | 1 | [ğŸ”—](<https://www.producthunt.com/r/AHFCA7BPXMWPZM?utm_campaign=producthunt-api&utm_medium=api-v2&utm_source=Application%3A+StatisticAPI+%28ID%3A+263803%29>) |
| 77 | [Wondybook](<https://www.producthunt.com/products/wondybook?utm_campaign=producthunt-api&utm_medium=api-v2&utm_source=Application%3A+StatisticAPI+%28ID%3A+263803%29>) | Your child as the hero of a real storybook<br><details><summary><strong>Full description</strong></summary><br>Wondybook turns a single childâ€™s photo into a fully illustrated, personalized storybook. Unlike most â€œname swapâ€ books, the childâ€™s likeness is generated directly into every scene, with consistent character design across the entire story. Preview the book instantly before ordering. Printed as a premium hardcover and shipped on demand. Built with a custom AI pipeline focused on visual consistency and narrative quality.<br></details> | 4 | 1 | [ğŸ”—](<https://www.producthunt.com/r/M5AN7O3WC4IYTJ?utm_campaign=producthunt-api&utm_medium=api-v2&utm_source=Application%3A+StatisticAPI+%28ID%3A+263803%29>) |
| 78 | [NoFilterÂ®](<https://www.producthunt.com/products/nofilter?utm_campaign=producthunt-api&utm_medium=api-v2&utm_source=Application%3A+StatisticAPI+%28ID%3A+263803%29>) | Find the best photo locations near you<br><details><summary><strong>Full description</strong></summary><br>Discover the best photo spots nearby and worldwide with NoFilter. Find stunning locations reviewed by photographers. After near 10 long years, a big new launch was released with a lot of AI injected, to make the trip more personalized<br></details> | 4 | 1 | [ğŸ”—](<https://www.producthunt.com/r/UTCMX626J7U4W4?utm_campaign=producthunt-api&utm_medium=api-v2&utm_source=Application%3A+StatisticAPI+%28ID%3A+263803%29>) |
| 79 | [GitHub](<https://www.producthunt.com/products/github-281?utm_campaign=producthunt-api&utm_medium=api-v2&utm_source=Application%3A+StatisticAPI+%28ID%3A+263803%29>) | ESLint for your translations, built for next-intl<br><details><summary><strong>Full description</strong></summary><br>A fast CLI tool for checking internationalization (i18n) issues in Next.js projects using next-intl. - Sukitly/glotctl<br></details> | 4 | 1 | [ğŸ”—](<https://www.producthunt.com/r/SXWDP33IPBLJQ5?utm_campaign=producthunt-api&utm_medium=api-v2&utm_source=Application%3A+StatisticAPI+%28ID%3A+263803%29>) |
| 80 | [LaunchYourClaw](<https://www.producthunt.com/products/launchyourclaw?utm_campaign=producthunt-api&utm_medium=api-v2&utm_source=Application%3A+StatisticAPI+%28ID%3A+263803%29>) | Deploy your openclaw / clawdbot in seconds<br><details><summary><strong>Full description</strong></summary><br>Openclaw is the AI that actually does things. Launch Your Claw deploys a private OpenClaw agent gateway for youâ€”no complex setup, SSH, or Node.js required. Access your personal AI across WhatsApp, Telegram, and Discord. Automate emails, manage your calendar, and control your digital world via natural language from the chat apps you already use. Private, secure, and ready in seconds.<br></details> | 4 | 1 | [ğŸ”—](<https://www.producthunt.com/r/H5SWNFNSN3IA5V?utm_campaign=producthunt-api&utm_medium=api-v2&utm_source=Application%3A+StatisticAPI+%28ID%3A+263803%29>) |
| 81 | [OneLauncher](<https://www.producthunt.com/products/onelauncher?utm_campaign=producthunt-api&utm_medium=api-v2&utm_source=Application%3A+StatisticAPI+%28ID%3A+263803%29>) | Your schedule, tasks, and clipboard history always in sight<br><details><summary><strong>Full description</strong></summary><br>If Iâ€™m deep in code, thereâ€™s a solid chance Iâ€™ll lose track of timeâ€¦ and magically appear 5mins late to a meeting wondering â€œhow is it already 11:00?â€ Calendar notifications werenâ€™t cutting it and keeping the full calendar app open all day felt like wasting half my screen. So I built OneLauncher â€” a slim macOS side panel that docks to the right of your screen and keeps todayâ€™s schedule and tasks visible at all times. No switching apps. No giant windows. Just what you need, always there. FREE!<br></details> | 4 | 1 | [ğŸ”—](<https://www.producthunt.com/r/2XIPLKVVZPEIRP?utm_campaign=producthunt-api&utm_medium=api-v2&utm_source=Application%3A+StatisticAPI+%28ID%3A+263803%29>) |
| 82 | [Palabrify](<https://www.producthunt.com/products/palabrify?utm_campaign=producthunt-api&utm_medium=api-v2&utm_source=Application%3A+StatisticAPI+%28ID%3A+263803%29>) | Learn vocab from your real-life context<br><details><summary><strong>Full description</strong></summary><br>Master Spanish, English, and more with Palabrify. The AI-powered language learning app featuring smart flashcards, spaced repetition, and grammar drills. Download for iOS.<br></details> | 4 | 1 | [ğŸ”—](<https://www.producthunt.com/r/3LMQN5TJ5DJSIV?utm_campaign=producthunt-api&utm_medium=api-v2&utm_source=Application%3A+StatisticAPI+%28ID%3A+263803%29>) |
| 83 | [Fidopics](<https://www.producthunt.com/products/fidopics?utm_campaign=producthunt-api&utm_medium=api-v2&utm_source=Application%3A+StatisticAPI+%28ID%3A+263803%29>) | Your Product, Faithfully Featured in Every Scene<br><details><summary><strong>Full description</strong></summary><br>Product Photography, Simplified. Stop struggling with expensive studios or complex apps that get your product wrong. Fidopics gives you professional, high-converting photos for Amazon, Etsy, and social media in seconds. Your Product, Perfected We achieve over 90% accuracy in replicating your product&#x27;s details and textâ€”far surpassing standard AI tools. While no technology is perfect, our specialized engine ensures your brand looks right, the vast majority of the time.<br></details> | 4 | 1 | [ğŸ”—](<https://www.producthunt.com/r/3NYKPJ53NVZUM5?utm_campaign=producthunt-api&utm_medium=api-v2&utm_source=Application%3A+StatisticAPI+%28ID%3A+263803%29>) |
| 84 | [PokeDex Plus Plus](<https://www.producthunt.com/products/pokedex-plus-plus?utm_campaign=producthunt-api&utm_medium=api-v2&utm_source=Application%3A+StatisticAPI+%28ID%3A+263803%29>) | Your Ultimate PokÃ©mon Adventure<br><details><summary><strong>Full description</strong></summary><br>PokeDex++ is a fan-made PokÃ©mon companion app built for c trainers who want more than just a traditional PokÃ©dex. It started as a mobile app, but since I couldnâ€™t afford the Play Store developer fee, I rebuilt the entire project as a web app using React and launched it independently. â€¢ Browse detailed pages for every PokÃ©mon â€¢ Collect beautifully designed PokÃ©mon cards â€¢ Unlock card skins and visual effects â€¢ Earn DexCoins and progress with your buddy â€¢ Enjoy a fast, clean, and modern interface<br></details> | 4 | 1 | [ğŸ”—](<https://www.producthunt.com/r/G2X2RQSCHZ3SOU?utm_campaign=producthunt-api&utm_medium=api-v2&utm_source=Application%3A+StatisticAPI+%28ID%3A+263803%29>) |
| 85 | [BuiltByIndies](<https://www.producthunt.com/products/builtbyindies?utm_campaign=producthunt-api&utm_medium=api-v2&utm_source=Application%3A+StatisticAPI+%28ID%3A+263803%29>) | Discover the Best New SaaS Products &amp; Launch Indie SaaS<br><details><summary><strong>Full description</strong></summary><br>The community for indie makers to launch their startups, share their stories, and get feedback. Discover the next big thing in SaaS before it goes mainstream.<br></details> | 4 | 0 | [ğŸ”—](<https://www.producthunt.com/r/LV347IVD4HW2GI?utm_campaign=producthunt-api&utm_medium=api-v2&utm_source=Application%3A+StatisticAPI+%28ID%3A+263803%29>) |
| 86 | [KIRA 5.0](<https://www.producthunt.com/products/kira-5-0?utm_campaign=producthunt-api&utm_medium=api-v2&utm_source=Application%3A+StatisticAPI+%28ID%3A+263803%29>) | Offline Ai powered IDE<br><details><summary><strong>Full description</strong></summary><br>KIRA 5.0 is a fully autonomous AI coding agent that runs on your machine. Offline first with Ollama, no cloud needed. Plug in Claude, ChatGPT, or Gemini as tutors. KIRA learns from every conversation. Full IDE with Monaco editor, terminal, live preview. Autonomous mode builds entire projects solo. War Room runs multiple AIs on one problem. Image generation, web browsing, git, test runner built in. Persistent memory across sessions. Budget controls per provider. Own it forever, no subscription.<br></details> | 4 | 0 | [ğŸ”—](<https://www.producthunt.com/r/XB6DFXU5VGKRUG?utm_campaign=producthunt-api&utm_medium=api-v2&utm_source=Application%3A+StatisticAPI+%28ID%3A+263803%29>) |
| 87 | [Options Pro](<https://www.producthunt.com/products/options-pro?utm_campaign=producthunt-api&utm_medium=api-v2&utm_source=Application%3A+StatisticAPI+%28ID%3A+263803%29>) | The easiest way to track options trades &amp; risk<br><details><summary><strong>Full description</strong></summary><br>OptionsPro is built specifically for options traders whoâ€™ve outgrown spreadsheets. Unlike stock-first journaling tools, it groups multi-leg strategies properly and shows P&amp;L the way options traders think. We focus on clear strategy tracking, built-in Greeks, and risk visibility in a simple interface. Launching in early access, the founding users help shape the product and secure discounted pricing.<br></details> | 4 | 1 | [ğŸ”—](<https://www.producthunt.com/r/QYYBX2ZXP4U3NA?utm_campaign=producthunt-api&utm_medium=api-v2&utm_source=Application%3A+StatisticAPI+%28ID%3A+263803%29>) |
| 88 | [MyPaymentsLog](<https://www.producthunt.com/products/mypaymentslog-2?utm_campaign=producthunt-api&utm_medium=api-v2&utm_source=Application%3A+StatisticAPI+%28ID%3A+263803%29>) | See exactly where your money goes.<br><details><summary><strong>Full description</strong></summary><br>MyPaymentsLog is a clean, read-only payment tracker built for clarity, not control. Securely link your bank accounts, view unified transactions, upload receipts with line-item breakdown (OCR), and see simple earned vs spent summaries. No budgeting pressure. No money movement. Just a clear, structured log of where your money actually goes.<br></details> | 4 | 1 | [ğŸ”—](<https://www.producthunt.com/r/6XXMVOILB4PT5U?utm_campaign=producthunt-api&utm_medium=api-v2&utm_source=Application%3A+StatisticAPI+%28ID%3A+263803%29>) |
| 89 | [Konvertly](<https://www.producthunt.com/products/konvertly-2?utm_campaign=producthunt-api&utm_medium=api-v2&utm_source=Application%3A+StatisticAPI+%28ID%3A+263803%29>) | Find Leads. Write Emails. Book Meetings. All on Autopilot<br><details><summary><strong>Full description</strong></summary><br>Konvertly is the first all-in-one AI SDR that handles your entire outbound pipeline in one dashboard. Find Leads, connect your email account and let the AI handle the rest with, Auto follow-ups, email reply and a dedicated dashboard to monitor everything all in one place.<br></details> | 4 | 1 | [ğŸ”—](<https://www.producthunt.com/r/CTPDTWECWYVWJQ?utm_campaign=producthunt-api&utm_medium=api-v2&utm_source=Application%3A+StatisticAPI+%28ID%3A+263803%29>) |
| 90 | [AgoraMaven](<https://www.producthunt.com/products/agoramaven?utm_campaign=producthunt-api&utm_medium=api-v2&utm_source=Application%3A+StatisticAPI+%28ID%3A+263803%29>) | Get &amp; tune your startup strategies for FREE &amp; automate tasks<br><details><summary><strong>Full description</strong></summary><br>AgoraMaven is an AI-driven advisory and operations platform for startups. Get business planning, strategies, 5-year financial projections, investor lists, and task automation. It&#x27;s free to get started!<br></details> | 4 | 1 | [ğŸ”—](<https://www.producthunt.com/r/4WZDEY5QZ24MXI?utm_campaign=producthunt-api&utm_medium=api-v2&utm_source=Application%3A+StatisticAPI+%28ID%3A+263803%29>) |
| 91 | [TonePerfect](<https://www.producthunt.com/products/toneperfect?utm_campaign=producthunt-api&utm_medium=api-v2&utm_source=Application%3A+StatisticAPI+%28ID%3A+263803%29>) | Master Chinese pronunciation with real-time AI feedback<br><details><summary><strong>Full description</strong></summary><br>Record your Mandarin and get instant AI feedback on tones, initials, and finals. Start with a free 2-minute placement test (level + per-sound breakdown) or practice with your own custom text.<br></details> | 3 | 1 | [ğŸ”—](<https://www.producthunt.com/r/KIIJRQ2FSXCGXC?utm_campaign=producthunt-api&utm_medium=api-v2&utm_source=Application%3A+StatisticAPI+%28ID%3A+263803%29>) |
| 92 | [Tonalitix](<https://www.producthunt.com/products/tonalitix?utm_campaign=producthunt-api&utm_medium=api-v2&utm_source=Application%3A+StatisticAPI+%28ID%3A+263803%29>) | Understand what users really think â€” in 5 minutes<br><details><summary><strong>Full description</strong></summary><br>Product managers and marketers waste hours scrolling through app reviews trying to find what&#x27;s broken and what users want. Tonalitix reads all your Google Play reviews with AI and sorts them into bugs, feature requests, and complaints automatically. Get a clear sentiment dashboard, compare with competitors, and spot problems before they cause churn â€” all within 5 minutes of pasting your app link.<br></details> | 3 | 1 | [ğŸ”—](<https://www.producthunt.com/r/CQ3I44FT32YCVK?utm_campaign=producthunt-api&utm_medium=api-v2&utm_source=Application%3A+StatisticAPI+%28ID%3A+263803%29>) |
| 93 | [Flip For Business](<https://www.producthunt.com/products/flip-for-business?utm_campaign=producthunt-api&utm_medium=api-v2&utm_source=Application%3A+StatisticAPI+%28ID%3A+263803%29>) | Pay freelancers globally. Send USDT, they get local cash.<br><details><summary><strong>Full description</strong></summary><br>Flip for Business lets UAE companies pay international freelancers instantly. Send USDT and your freelancer receives funds directly in their local bank account â€” no matter what country they&#x27;re in. No complex wallets, no FX markups, no 3-5 day waits. Just enter a phone number, send payment, done. Built for businesses tired of losing money to hidden wire transfer fees and slow cross-border banking. UAE compliant. Currently in public beta.<br></details> | 3 | 1 | [ğŸ”—](<https://www.producthunt.com/r/VUAAVSRNEKLJIQ?utm_campaign=producthunt-api&utm_medium=api-v2&utm_source=Application%3A+StatisticAPI+%28ID%3A+263803%29>) |
| 94 | [vett](<https://www.producthunt.com/products/vett-2?utm_campaign=producthunt-api&utm_medium=api-v2&utm_source=Application%3A+StatisticAPI+%28ID%3A+263803%29>) | Scan, sign, and verify AI agent skills before installing<br><details><summary><strong>Full description</strong></summary><br>When you install an AI agent skill, you&#x27;re running code pulled from GitHub at HEAD with no signing, versioning, or scanning. Vett scans every skill before it reaches your machine: static analysis, exfiltration chain detection, OSV dependency checks, and Sigstore signing. Early scans have already turned up malware disguised as Google and LinkedIn tools, and skills with thousands of installs that quietly modify your agent&#x27;s own configuration files.<br></details> | 3 | 1 | [ğŸ”—](<https://www.producthunt.com/r/4RIINS6VGYRYNI?utm_campaign=producthunt-api&utm_medium=api-v2&utm_source=Application%3A+StatisticAPI+%28ID%3A+263803%29>) |
| 95 | [Valentina Studio 17](<https://www.producthunt.com/products/valentina-studio?utm_campaign=producthunt-api&utm_medium=api-v2&utm_source=Application%3A+StatisticAPI+%28ID%3A+263803%29>) | Live visual SQL query updates, batch data transfer &amp; more<br><details><summary><strong>Full description</strong></summary><br>The best just got better. Now available for Windows on ARM. Query Builder now features live visual updates: changes to code are immediately reflected in your visual schema. Data transfer now works in user-defined batches. Valentina Forms (an alternative to Claris Filemaker or MS Access) now includes better documentation for scripting in Python and JavaScript.<br></details> | 3 | 1 | [ğŸ”—](<https://www.producthunt.com/r/JEDSIGUGTKUC3G?utm_campaign=producthunt-api&utm_medium=api-v2&utm_source=Application%3A+StatisticAPI+%28ID%3A+263803%29>) |
| 96 | [bozheville](<https://www.producthunt.com/products/bozheville?utm_campaign=producthunt-api&utm_medium=api-v2&utm_source=Application%3A+StatisticAPI+%28ID%3A+263803%29>) | Connect through who you are, not how you look<br><details><summary><strong>Full description</strong></summary><br>Bozheville is an interest-first connection platform for friendship and dating. Instead of leading with curated photos, users match through shared interests and pixel avatars first. We keep the familiar swipe mechanic but change what you evaluate. The goal is to reduce surface-level filtering and shift focus toward compatibility, conversation, and vibe before appearance.<br></details> | 3 | 1 | [ğŸ”—](<https://www.producthunt.com/r/4FMTG6LIT2TJRS?utm_campaign=producthunt-api&utm_medium=api-v2&utm_source=Application%3A+StatisticAPI+%28ID%3A+263803%29>) |
| 97 | [ChromaFit](<https://www.producthunt.com/products/chromafit?utm_campaign=producthunt-api&utm_medium=api-v2&utm_source=Application%3A+StatisticAPI+%28ID%3A+263803%29>) | Your AI fitness coach that actually sees your body.<br><details><summary><strong>Full description</strong></summary><br>Hey ProductHunt! I built ChromaFit because no app connected physique progress, training, and nutrition in one place. Physique Lab scores 8 muscle groups from a photo and builds a workout split around your weak points. The AI food scanner came next, manual logging is the #1 reason people quit tracking. Point, scan, done. Would love feedback on the scoring accuracy and anything missing. Happy to answer questions!<br></details> | 3 | 1 | [ğŸ”—](<https://www.producthunt.com/r/OYYCIZSC5UE3GW?utm_campaign=producthunt-api&utm_medium=api-v2&utm_source=Application%3A+StatisticAPI+%28ID%3A+263803%29>) |
| 98 | [Builtseen](<https://www.producthunt.com/products/builtseen?utm_campaign=producthunt-api&utm_medium=api-v2&utm_source=Application%3A+StatisticAPI+%28ID%3A+263803%29>) | The $1 influencer marketplace for indie builders<br><details><summary><strong>Full description</strong></summary><br>Builtseen â€” Influencer marketing from $1. Post your project with any budget. Verified X (Twitter) creators apply to promote it. No agencies, no cold DMs, no negotiations. Funds held in escrow until you&#x27;re satisfied. 7-day auto-validation protects both sides. Rating system surfaces the best creators. Free to start. What you built deserves to be seen.<br></details> | 3 | 1 | [ğŸ”—](<https://www.producthunt.com/r/LYQ7UD4BQC2VFE?utm_campaign=producthunt-api&utm_medium=api-v2&utm_source=Application%3A+StatisticAPI+%28ID%3A+263803%29>) |
| 99 | [Gilly](<https://www.producthunt.com/products/gilly-the-smart-glp-1-tracker?utm_campaign=producthunt-api&utm_medium=api-v2&utm_source=Application%3A+StatisticAPI+%28ID%3A+263803%29>) | Track injections, weight &amp; wellness. Pay once, own forever<br><details><summary><strong>Full description</strong></summary><br>Tired of basic GLP-1 trackers that nickel-and-dime you? Gilly offers real choice: free tier, and launch pricing option starting with flexible monthly ($4.99), annual ($39.99), or lifetime ($59.99) - pay once, own forever. Track 30+ medications, generate doctor visit PDFs, log weight trends, and capture progress photos. 100% private - your health data stays on your device, no cloud required. Built by a 3-year Mounjaro user who couldn&#x27;t find what she needed in other apps.<br></details> | 3 | 1 | [ğŸ”—](<https://www.producthunt.com/r/M5QQAVV6VFSMBZ?utm_campaign=producthunt-api&utm_medium=api-v2&utm_source=Application%3A+StatisticAPI+%28ID%3A+263803%29>) |
| 100 | [FullSignal](<https://www.producthunt.com/products/fullsignal?utm_campaign=producthunt-api&utm_medium=api-v2&utm_source=Application%3A+StatisticAPI+%28ID%3A+263803%29>) | Stop losing billable hours to tools you do not own<br><details><summary><strong>Full description</strong></summary><br>FullSignal is a white-label AI platform that keeps your clients, your knowledge, and your revenue inside your agency.<br></details> | 3 | 2 | [ğŸ”—](<https://www.producthunt.com/r/CZHUIQ7S2ZZ7FN?utm_campaign=producthunt-api&utm_medium=api-v2&utm_source=Application%3A+StatisticAPI+%28ID%3A+263803%29>) |
| 101 | [FullSignal](<https://www.producthunt.com/products/fullsignal?utm_campaign=producthunt-api&utm_medium=api-v2&utm_source=Application%3A+StatisticAPI+%28ID%3A+263803%29>) | Stop losing billable hours to tools you do not own<br><details><summary><strong>Full description</strong></summary><br>FullSignal is a white-label AI platform that keeps your clients, your knowledge, and your revenue inside your agency.<br></details> | 3 | 2 | [ğŸ”—](<https://www.producthunt.com/r/CZHUIQ7S2ZZ7FN?utm_campaign=producthunt-api&utm_medium=api-v2&utm_source=Application%3A+StatisticAPI+%28ID%3A+263803%29>) |
| 102 | [Savely - Discounted Gift Card Finder](<https://www.producthunt.com/products/savely-discounted-gift-card-finder?utm_campaign=producthunt-api&utm_medium=api-v2&utm_source=Application%3A+StatisticAPI+%28ID%3A+263803%29>) | Discover discounted gift cards from 700+ top brands<br><details><summary><strong>Full description</strong></summary><br>Unlock up to 25% off at 700+ top brands. Savely is your central directory for discounted gift cardsâ€”search deals, set custom alerts for the exact amounts you want to spend, and join the waitlist for our upcoming P2P marketplace.<br></details> | 3 | 1 | [ğŸ”—](<https://www.producthunt.com/r/GZSXY4MYTDNG5D?utm_campaign=producthunt-api&utm_medium=api-v2&utm_source=Application%3A+StatisticAPI+%28ID%3A+263803%29>) |
| 103 | [Agent Wall](<https://www.producthunt.com/products/agent-wall?utm_campaign=producthunt-api&utm_medium=api-v2&utm_source=Application%3A+StatisticAPI+%28ID%3A+263803%29>) | Security firewall for AI agents. Cloudflare for MCP.<br><details><summary><strong>Full description</strong></summary><br>AI agents executing tools expose your SSH keys andenv files to prompt injection. Agent Wall is an open-source firewall for MCP servers that intercepts every tool call. It enforces a 5-step defense pipeline: 1. Detects 30+ injection patterns 2. Blocks SSRF &amp; private IPs 3. Enforces YAML policies &amp; rate limits 4. Spots attack chains 5. Redacts secrets &amp; PII Secure your AI tool execution layer now.<br></details> | 3 | 1 | [ğŸ”—](<https://www.producthunt.com/r/LTC3TR5QB6ZFBT?utm_campaign=producthunt-api&utm_medium=api-v2&utm_source=Application%3A+StatisticAPI+%28ID%3A+263803%29>) |
| 104 | [Frozen Security](<https://www.producthunt.com/products/frozen-security?utm_campaign=producthunt-api&utm_medium=api-v2&utm_source=Application%3A+StatisticAPI+%28ID%3A+263803%29>) | Crypto you can hold.<br><details><summary><strong>Full description</strong></summary><br>Secure storage and signing for digital assets. No private key is ever held in software.<br></details> | 3 | 1 | [ğŸ”—](<https://www.producthunt.com/r/FKOU54HFDPIAER?utm_campaign=producthunt-api&utm_medium=api-v2&utm_source=Application%3A+StatisticAPI+%28ID%3A+263803%29>) |
| 105 | [MoveTogether](<https://www.producthunt.com/products/movetogether?utm_campaign=producthunt-api&utm_medium=api-v2&utm_source=Application%3A+StatisticAPI+%28ID%3A+263803%29>) | Run Fair Multi-Sport Competitions in Minutes<br><details><summary><strong>Full description</strong></summary><br>Different sports, different levels, running a fair competition shouldnâ€™t be this complicated. MoveTogether allows you to set scoring rules per activity, ensuring fair competition across sports. Participants join instantly, teams form automatically, and Strava syncs in real time. Live leaderboards, team chat, and multi-sport tracking included.<br></details> | 3 | 1 | [ğŸ”—](<https://www.producthunt.com/r/6KIQKUQYHVRX5Q?utm_campaign=producthunt-api&utm_medium=api-v2&utm_source=Application%3A+StatisticAPI+%28ID%3A+263803%29>) |
| 106 | [Chrono Civilizations](<https://www.producthunt.com/products/chrono-civilizations?utm_campaign=producthunt-api&utm_medium=api-v2&utm_source=Application%3A+StatisticAPI+%28ID%3A+263803%29>) | Every civilization, every era â€” one interactive map<br><details><summary><strong>Full description</strong></summary><br>In 500 BC, Confucius taught in China. Socrates debated in Athens. Buddha meditated in India. Darius conquered Persia. All happening at the same time. Now you can see it all on one map.<br></details> | 3 | 1 | [ğŸ”—](<https://www.producthunt.com/r/VO6AOOUM53OWJQ?utm_campaign=producthunt-api&utm_medium=api-v2&utm_source=Application%3A+StatisticAPI+%28ID%3A+263803%29>) |
| 107 | [A Dark Cave](<https://www.producthunt.com/products/a-dark-cave?utm_campaign=producthunt-api&utm_medium=api-v2&utm_source=Application%3A+StatisticAPI+%28ID%3A+263803%29>) | Survive or Perish<br><details><summary><strong>Full description</strong></summary><br>A Dark Cave is an incremental text-based survival and settlement-building game set in an unforgiving and cruel world. Light the fire, gather resources, craft weapons, build a village, and descend deeper into ancient ruins to uncover the dark secrets of a lost civilization. Play free in your browser on desktop or mobile.<br></details> | 3 | 1 | [ğŸ”—](<https://www.producthunt.com/r/U33MRMIFW7OBQD?utm_campaign=producthunt-api&utm_medium=api-v2&utm_source=Application%3A+StatisticAPI+%28ID%3A+263803%29>) |
| 108 | [Stylescape Generator](<https://www.producthunt.com/products/stylescape-generator?utm_campaign=producthunt-api&utm_medium=api-v2&utm_source=Application%3A+StatisticAPI+%28ID%3A+263803%29>) | Instant visual stylescapes from any website<br><details><summary><strong>Full description</strong></summary><br>Stylescape Generator creates a complete visual stylescape from any website in seconds. It extracts color systems, typography (including type scale ratios), key imagery, spacing tokens, layout patterns, and auto-generated brand personality tags. The output opens as a clean bento-style board you can screenshot, export, or drop directly into your design workflow. Built for designers, agencies, and brand strategists who want fast, structured visual analysis.<br></details> | 3 | 1 | [ğŸ”—](<https://www.producthunt.com/r/SFHKXGPECHLP4G?utm_campaign=producthunt-api&utm_medium=api-v2&utm_source=Application%3A+StatisticAPI+%28ID%3A+263803%29>) |
| 109 | [Plaudera](<https://www.producthunt.com/products/plaudera?utm_campaign=producthunt-api&utm_medium=api-v2&utm_source=Application%3A+StatisticAPI+%28ID%3A+263803%29>) | Customer feedback + feature request board for SaaS teams<br><details><summary><strong>Full description</strong></summary><br>Collect feedback, prioritize feature requests, and share a public roadmap â€” in one simple tool built for SaaS teams.<br></details> | 3 | 1 | [ğŸ”—](<https://www.producthunt.com/r/Y62OQJV6J3TTKF?utm_campaign=producthunt-api&utm_medium=api-v2&utm_source=Application%3A+StatisticAPI+%28ID%3A+263803%29>) |
| 110 | [KoKo Credit Card Assistant](<https://www.producthunt.com/products/koko-credit-card-assistant?utm_campaign=producthunt-api&utm_medium=api-v2&utm_source=Application%3A+StatisticAPI+%28ID%3A+263803%29>) | Smarter, privacy-first credit card decisions powered by AI<br><details><summary><strong>Full description</strong></summary><br>Koko is a privacy-first AI assistant that removes the guesswork from credit cards. It evaluates rewards, perks, and fees to help you use the right card at the right time and get more value from the cards you already carry â€” no bank logins, no data sharing, just smart AI-driven recommendations.<br></details> | 3 | 2 | [ğŸ”—](<https://www.producthunt.com/r/VZASA4NOVTGJ6M?utm_campaign=producthunt-api&utm_medium=api-v2&utm_source=Application%3A+StatisticAPI+%28ID%3A+263803%29>) |
| 111 | [CampZeo](<https://www.producthunt.com/products/campzeo?utm_campaign=producthunt-api&utm_medium=api-v2&utm_source=Application%3A+StatisticAPI+%28ID%3A+263803%29>) | Social Media Management and campaign management<br><details><summary><strong>Full description</strong></summary><br>Social Media Management Platform - Streamline and automate your social media with powerful tools and insights. Manage Facebook, Instagram, LinkedIn, pintrest and YouTube all in one place.<br></details> | 3 | 2 | [ğŸ”—](<https://www.producthunt.com/r/CV5I7HV2ZT7LBU?utm_campaign=producthunt-api&utm_medium=api-v2&utm_source=Application%3A+StatisticAPI+%28ID%3A+263803%29>) |
| 112 | [GrepCoder](<https://www.producthunt.com/products/grepcoder?utm_campaign=producthunt-api&utm_medium=api-v2&utm_source=Application%3A+StatisticAPI+%28ID%3A+263803%29>) | Kill LeetCode. Let candidates prove they can build<br><details><summary><strong>Full description</strong></summary><br>GrepCoder is a coding interview platform where candidates work on real projects with an AI coding assistant. An AI interviewer analyzes their code and asks follow-up questions to explore their reasoning. Companies see how candidates build real features, and candidates don&#x27;t have to optimize for resume buzzwords. Instead of reading hundreds of resumes to find who to interview, send every applicant a GrepCoder interview first. Let them prove they can build.<br></details> | 3 | 1 | [ğŸ”—](<https://www.producthunt.com/r/LE2PV6HOX7EIFZ?utm_campaign=producthunt-api&utm_medium=api-v2&utm_source=Application%3A+StatisticAPI+%28ID%3A+263803%29>) |
| 113 | [Pixello](<https://www.producthunt.com/products/pixello?utm_campaign=producthunt-api&utm_medium=api-v2&utm_source=Application%3A+StatisticAPI+%28ID%3A+263803%29>) | From idea to production without handoffs.<br><details><summary><strong>Full description</strong></summary><br>Introducing Pixello - agentic, code-native canvas built for fast moving teams. Iterate fast by creating with AI and editing manually when required - all at one place. The designs are generated using code, so design handover become smooth. What&#x27;s more? there&#x27;s Pixello extension that allows to copy any component from web - by a simple copy &amp; paste.<br></details> | 3 | 0 | [ğŸ”—](<https://www.producthunt.com/r/EGDRTAXYUPGMXI?utm_campaign=producthunt-api&utm_medium=api-v2&utm_source=Application%3A+StatisticAPI+%28ID%3A+263803%29>) |
| 114 | [Wisheria](<https://www.producthunt.com/products/wisheria?utm_campaign=producthunt-api&utm_medium=api-v2&utm_source=Application%3A+StatisticAPI+%28ID%3A+263803%29>) | Where Wishes Come to Life<br><details><summary><strong>Full description</strong></summary><br>Create wishes, share dreams, and receive contributions from friends. Make every occasion special with Wisheria.<br></details> | 3 | 1 | [ğŸ”—](<https://www.producthunt.com/r/NJB7PVOHJEZORV?utm_campaign=producthunt-api&utm_medium=api-v2&utm_source=Application%3A+StatisticAPI+%28ID%3A+263803%29>) |
| 115 | [Zrost.ai](<https://www.producthunt.com/products/zrost-ai?utm_campaign=producthunt-api&utm_medium=api-v2&utm_source=Application%3A+StatisticAPI+%28ID%3A+263803%29>) | Predictable development, not vibing<br><details><summary><strong>Full description</strong></summary><br>Zrost is the only platform where AI doesnâ€™t just code â€” it plans, manages, and adapts your entire project. Talk to an AI PM to create and manage tasks, then let specialized agents (frontend, backend, QA, DevOps) execute as a coordinated team. Visual dependency graphs, Kanban boards, and GitHub integration keep everything in sync. Like adding 2-3 mid-level devs who never stop to your existing team members.<br></details> | 3 | 2 | [ğŸ”—](<https://www.producthunt.com/r/IXOJCN5O6IRQE5?utm_campaign=producthunt-api&utm_medium=api-v2&utm_source=Application%3A+StatisticAPI+%28ID%3A+263803%29>) |
| 116 | [Gemini TTS](<https://www.producthunt.com/products/gemini-tts?utm_campaign=producthunt-api&utm_medium=api-v2&utm_source=Application%3A+StatisticAPI+%28ID%3A+263803%29>) | AI-powered text-to-speech with emotional depth<br><details><summary><strong>Full description</strong></summary><br>Create lifelike audio with Gemini TTS. Transform text into emotionally rich speech with precise control over tone, pitch, and pacing for immersive storytelling.<br></details> | 3 | 1 | [ğŸ”—](<https://www.producthunt.com/r/5QURBVWVUINKXW?utm_campaign=producthunt-api&utm_medium=api-v2&utm_source=Application%3A+StatisticAPI+%28ID%3A+263803%29>) |
| 117 | [SafeClaw](<https://www.producthunt.com/products/safeclaw?utm_campaign=producthunt-api&utm_medium=api-v2&utm_source=Application%3A+StatisticAPI+%28ID%3A+263803%29>) | Security-first hosting for AI agents<br><details><summary><strong>Full description</strong></summary><br>Secure cloud runtime for OpenClaw/Clawdbot with isolated execution, scoped credentials, and one-click teardown. Run AI agents away from your personal machine with controlled network access, action logs, and fast stop controls. Built for security-conscious teams who need practical safeguards without DIY infrastructure.<br></details> | 3 | 1 | [ğŸ”—](<https://www.producthunt.com/r/3CTO32PB2ZL2AW?utm_campaign=producthunt-api&utm_medium=api-v2&utm_source=Application%3A+StatisticAPI+%28ID%3A+263803%29>) |
| 118 | [Consistent Character](<https://www.producthunt.com/products/consistent-character-3?utm_campaign=producthunt-api&utm_medium=api-v2&utm_source=Application%3A+StatisticAPI+%28ID%3A+263803%29>) | Turn your consistent AI characters into video stars.<br><details><summary><strong>Full description</strong></summary><br>Itâ€™s not just for static images anymore. Once you&#x27;ve designed your perfect character, animate them with our integrated AI video tools. Generate consistent video clips where your character moves, acts, and speaks without losing their unique look.<br></details> | 3 | 1 | [ğŸ”—](<https://www.producthunt.com/r/ULC6IBCWB2QQYY?utm_campaign=producthunt-api&utm_medium=api-v2&utm_source=Application%3A+StatisticAPI+%28ID%3A+263803%29>) |
| 119 | [Solidcheck](<https://www.producthunt.com/products/solidcheck?utm_campaign=producthunt-api&utm_medium=api-v2&utm_source=Application%3A+StatisticAPI+%28ID%3A+263803%29>) | All-in-one digitals assets risk &amp; compliance SaaS<br><details><summary><strong>Full description</strong></summary><br>Solidcheck is a digital asset risk and compliance platform for custodians and financial institutions. It replaces spreadsheets with a SaaS dashboard that monitors thousands of assets across chains, tracking governance changes, key rotations, upgrades, hacks, and suspicious activity. It auto-triggers reassessments, updates its DARAÂ© risk score, and provides MiCAâ€‘aligned, audit-ready reporting.<br></details> | 3 | 1 | [ğŸ”—](<https://www.producthunt.com/r/OBAWAEJJZIJOIK?utm_campaign=producthunt-api&utm_medium=api-v2&utm_source=Application%3A+StatisticAPI+%28ID%3A+263803%29>) |
| 120 | [WatchGuide](<https://www.producthunt.com/products/watchguide?utm_campaign=producthunt-api&utm_medium=api-v2&utm_source=Application%3A+StatisticAPI+%28ID%3A+263803%29>) | An app to find what to watch and where to watch it<br><details><summary><strong>Full description</strong></summary><br>Watch Guide is an iOS app made for recommending movies and shows, and even discover new ones, then shows you where to watch the movie or show youâ€™d like to watch. Whether it be the secrets behind the doors of The Housemaid or the Epic conclusion to the Infinity Saga with Avengers: Endgame, youâ€™ll find where to watch your favourites.<br></details> | 3 | 1 | [ğŸ”—](<https://www.producthunt.com/r/66BMSFVDIZJYJO?utm_campaign=producthunt-api&utm_medium=api-v2&utm_source=Application%3A+StatisticAPI+%28ID%3A+263803%29>) |
| 121 | [CheckAPI](<https://www.producthunt.com/products/checkapi?utm_campaign=producthunt-api&utm_medium=api-v2&utm_source=Application%3A+StatisticAPI+%28ID%3A+263803%29>) | Modern API monitoring for indie hackers &amp; small teams<br><details><summary><strong>Full description</strong></summary><br>Monitor your APIs 24/7 with instant alerts via Email, Slack, Telegram, Discord, or Webhooks. ğŸš€ 60-second setup ğŸ¨ Modern UI (Next.js 14) ğŸ’° Affordable ($5-15/mo vs $75-100/mo enterprise) ğŸ”“ Open source (MIT) ğŸ¤– Built in 6 weeks with OpenClaw AI Track uptime, response times, and incidents. Get alerted instantly when your API goes down. For indie hackers, not enterprises. Free: 3 monitors, 5-min checks. No credit card.<br></details> | 3 | 1 | [ğŸ”—](<https://www.producthunt.com/r/WIU3GBU3DNP5DU?utm_campaign=producthunt-api&utm_medium=api-v2&utm_source=Application%3A+StatisticAPI+%28ID%3A+263803%29>) |
